category,file_id,format,width,height,category_name,label,file_path,local,name,description
holiday,15755,gif,16,16,节日_IDM,ALL,https://images.heaton.com.cn/download/675bdcdf0654b5.52874832,library_16/holiday/15755.gif,reindeer-2,A brown reindeer face on a blue background. Antlered animal.
holiday,15756,gif,16,16,节日_IDM,ALL,https://images.heaton.com.cn/download/675bdcdf0654e7.69494899,library_16/holiday/15756.gif,santa-dog,A brown dog wearing a Santa hat on a blue background. Festive pet.
holiday,15757,gif,16,16,节日_IDM,ALL,https://images.heaton.com.cn/download/675bdcdf065529.39850376,library_16/holiday/15757.gif,dark-red,A mostly dark scene with red accents. Near-empty/moody frame.
holiday,15758,gif,16,16,节日_IDM,ALL,https://images.heaton.com.cn/download/675bdcdf065564.03906454,library_16/holiday/15758.gif,fireplace-stockings,A fireplace hung with stockings on a brown background. Cozy Christmas hearth.
holiday,15759,gif,16,16,节日_IDM,ALL,https://images.heaton.com.cn/download/675bdcdf0655a4.87610755,library_16/holiday/15759.gif,santa-hat,A red Santa hat on a blue background. Festive headwear.
holiday,15760,gif,16,16,节日_IDM,ALL,https://images.heaton.com.cn/download/675bdcdf0655d0.21992190,library_16/holiday/15760.gif,white-cat,A white cat outline on a dark background. Minimal feline.
holiday,15761,gif,16,16,节日_IDM,ALL,https://images.heaton.com.cn/download/675bdcdf065612.69843261,library_16/holiday/15761.gif,halloween-cat,A black cat with pumpkins on a purple background. Halloween scene.
holiday,15762,gif,16,16,节日_IDM,ALL,https://images.heaton.com.cn/download/675bdcdf065654.65765064,library_16/holiday/15762.gif,pumpkin-2,An orange pumpkin on a teal background. Autumn icon.
holiday,15763,gif,16,16,节日_IDM,ALL,https://images.heaton.com.cn/download/675bdcdf065750.34745161,library_16/holiday/15763.gif,orange-ghost,An orange ghost/flame shape on a dark background. Spooky motif.
holiday,15764,gif,16,16,节日_IDM,ALL,https://images.heaton.com.cn/download/675bdcdf0657a7.81267086,library_16/holiday/15764.gif,bat,A purple bat on a dark background. Halloween creature.
holiday,15765,gif,16,16,节日_IDM,ALL,https://images.heaton.com.cn/download/675bdcdf0657e3.46977042,library_16/holiday/15765.gif,zombie,A green zombie on a red background. Spooky monster.
holiday,15766,gif,16,16,节日_IDM,ALL,https://images.heaton.com.cn/download/675bdcdf065827.01657800,library_16/holiday/15766.gif,white-ghost,A white ghost with sparkles on a dark background. Halloween spirit.
holiday,15767,gif,16,16,节日_IDM,ALL,https://images.heaton.com.cn/download/675bdcdf065865.00544521,library_16/holiday/15767.gif,jack-o-lantern,A smiling jack-o'-lantern on a dark background. Halloween pumpkin.
holiday,15768,gif,16,16,节日_IDM,ALL,https://images.heaton.com.cn/download/675bdcdf0658a3.61632096,library_16/holiday/15768.gif,bat-2,A bat with glowing eyes on a dark background. Halloween creature.
holiday,15769,gif,16,16,节日_IDM,ALL,https://images.heaton.com.cn/download/675bdcdf0658e9.36919642,library_16/holiday/15769.gif,yellow-monster,A yellow monster/pumpkin face with a grin on dark. Spooky character.
holiday,15770,gif,16,16,节日_IDM,ALL,https://images.heaton.com.cn/download/675bdcdf065910.02380149,library_16/holiday/15770.gif,frankenstein,A green Frankenstein's-monster face on a dark background. Halloween creature.
holiday,15771,gif,16,16,节日_IDM,ALL,https://images.heaton.com.cn/download/675bdcdf065951.08948084,library_16/holiday/15771.gif,orange-box,An orange boxy robot/pumpkin face on a dark background. Halloween character.
holiday,15772,gif,16,16,节日_IDM,ALL,https://images.heaton.com.cn/download/675bdcdf065994.55129999,library_16/holiday/15772.gif,skull,A white skull on a dark background. Bony Halloween motif.
holiday,15773,gif,16,16,节日_IDM,ALL,https://images.heaton.com.cn/download/675bdcdf0659d0.47545758,library_16/holiday/15773.gif,skull-2,A white skull/skeleton with red eyes on dark. Spooky motif.
holiday,15774,gif,16,16,节日_IDM,ALL,https://images.heaton.com.cn/download/675bdcdf065a25.90214157,library_16/holiday/15774.gif,vampire-teeth,A vampire mouth with red fangs on a dark background. Spooky motif.
holiday,15775,gif,16,16,节日_IDM,ALL,https://images.heaton.com.cn/download/675bdcdf065a67.90117540,library_16/holiday/15775.gif,pumpkin-3,A jack-o'-lantern pumpkin on a brown background. Halloween icon.
holiday,15776,gif,16,16,节日_IDM,ALL,https://images.heaton.com.cn/download/675bdcdf065a99.31514716,library_16/holiday/15776.gif,grim-reaper,A dark grim-reaper/cloaked figure on a dark background. Spooky character.
holiday,15777,gif,16,16,节日_IDM,ALL,https://images.heaton.com.cn/download/675bdcdf065ad1.95604092,library_16/holiday/15777.gif,witch-pumpkin,A jack-o'-lantern wearing a witch hat on cyan. Halloween mashup.
holiday,15778,gif,16,16,节日_IDM,ALL,https://images.heaton.com.cn/download/675bdcdf065b13.91621629,library_16/holiday/15778.gif,jack-o-lantern-2,A jack-o'-lantern pumpkin on a purple background. Halloween icon.
holiday,15779,gif,16,16,节日_IDM,ALL,https://images.heaton.com.cn/download/675bdcdf065b55.94260049,library_16/holiday/15779.gif,white-ghost-2,A white ghost on a dark background. Halloween spirit.
holiday,15780,gif,16,16,节日_IDM,ALL,https://images.heaton.com.cn/download/675bdcdf065b98.98229135,library_16/holiday/15780.gif,skeleton,A white-skulled skeleton figure on a purple background. Halloween character.
holiday,15781,gif,16,16,节日_IDM,ALL,https://images.heaton.com.cn/download/675bdcdf065c01.09913326,library_16/holiday/15781.gif,red-devil,A red devil/demon face on a dark background. Spooky character.
holiday,15782,gif,16,16,节日_IDM,ALL,https://images.heaton.com.cn/download/675bdcdf065c45.06903957,library_16/holiday/15782.gif,purple-zombie,A purple zombie/witch creature on a dark background. Halloween monster.
holiday,15783,gif,16,16,节日_IDM,ALL,https://images.heaton.com.cn/download/675bdcdf065c83.57224469,library_16/holiday/15783.gif,blue-clown,A blue Joker/clown face on a gray background. Creepy portrait.
holiday,15784,gif,16,16,节日_IDM,ALL,https://images.heaton.com.cn/download/675bdcdf065cc5.05811662,library_16/holiday/15784.gif,ghost-red-eyes,A white ghost with red eyes on a dark background. Spooky spirit.
holiday,15785,gif,16,16,节日_IDM,ALL,https://images.heaton.com.cn/download/675bdcdf065d04.37496710,library_16/holiday/15785.gif,candle,A purple candle/lantern on a dark background. Light motif.
holiday,15786,gif,16,16,节日_IDM,ALL,https://images.heaton.com.cn/download/675bdcdf065d48.15995538,library_16/holiday/15786.gif,blue-hair-figure,A snowman/robot figure with blue hair on dark. Quirky character.
holiday,15787,gif,16,16,节日_IDM,ALL,https://images.heaton.com.cn/download/675bdcdf065da8.55977196,library_16/holiday/15787.gif,sky-hearts,Pink hearts floating in a cloudy sky. Love-in-the-air motif.
holiday,15789,gif,16,16,节日_IDM,ALL,https://images.heaton.com.cn/download/675bdcdf065e28.44806020,library_16/holiday/15789.gif,orange-face,An orange face/pumpkin with a smile on tan. Cheerful Halloween face.
holiday,15790,gif,16,16,节日_IDM,ALL,https://images.heaton.com.cn/download/675bdcdf065e67.79965326,library_16/holiday/15790.gif,cupid-heart,A pink heart with an arrow on a dark background. Cupid's-arrow love symbol.
holiday,15791,gif,16,16,节日_IDM,ALL,https://images.heaton.com.cn/download/675bdcdf065ea7.82243080,library_16/holiday/15791.gif,pink-screen,A monitor/TV with a pink screen on a dark background. Display motif.
holiday,15792,gif,16,16,节日_IDM,ALL,https://images.heaton.com.cn/download/675bdcdf065ee1.18043904,library_16/holiday/15792.gif,red-rose,A red rose/flame flower on a tan background. Floral motif.
holiday,15793,gif,16,16,节日_IDM,ALL,https://images.heaton.com.cn/download/675bdcdf065f24.79160568,library_16/holiday/15793.gif,year-2020,The numbers '2020' on a dark background. New-year motif.
holiday,15794,gif,16,16,节日_IDM,ALL,https://images.heaton.com.cn/download/675bdcdf065f84.62809700,library_16/holiday/15794.gif,green-heart,A green heart outline on a teal background. Love icon.
holiday,15795,gif,16,16,节日_IDM,ALL,https://images.heaton.com.cn/download/675bdcdf065fc5.16842039,library_16/holiday/15795.gif,snowflake,A blue snowflake with red dots on a dark background. Winter motif.
holiday,15796,gif,16,16,节日_IDM,ALL,https://images.heaton.com.cn/download/675bdcdf066001.62052272,library_16/holiday/15796.gif,green-monster-2,A green monster/creature with red accents on dark. Spooky critter.
holiday,15797,gif,16,16,节日_IDM,ALL,https://images.heaton.com.cn/download/675bdcdf066034.74510967,library_16/holiday/15797.gif,sunset-heart,A heart containing a sunset on a dark background. Romantic motif.
holiday,15798,gif,16,16,节日_IDM,ALL,https://images.heaton.com.cn/download/675bdcdf066073.40847757,library_16/holiday/15798.gif,graveyard,A gray graveyard with tombstones on a dark background. Spooky cemetery.
holiday,15799,gif,16,16,节日_IDM,ALL,https://images.heaton.com.cn/download/675bdcdf0660b3.07081656,library_16/holiday/15799.gif,pink-monster,A pink monster/bat with hearts on a dark background. Cute-spooky creature.
holiday,15800,gif,16,16,节日_IDM,ALL,https://images.heaton.com.cn/download/675bdcdf066116.61076007,library_16/holiday/15800.gif,purple-heart-2,A purple-pink 3D heart on a purple background. Love icon.
holiday,15801,gif,16,16,节日_IDM,ALL,https://images.heaton.com.cn/download/675bdcdf066150.59493563,library_16/holiday/15801.gif,winged-heart,A red heart with wings/bird on a blue sky. Flying-love motif.
holiday,15802,gif,16,16,节日_IDM,ALL,https://images.heaton.com.cn/download/675bdcdf066198.57511554,library_16/holiday/15802.gif,heart-wreath,A red heart encircled by a green wreath on dark. Valentine-holiday blend.
holiday,15803,gif,16,16,节日_IDM,ALL,https://images.heaton.com.cn/download/675bdcdf0661d6.68195144,library_16/holiday/15803.gif,blue-vial,A blue bottle/vial of potion on a light background. Liquid container.
holiday,15804,gif,16,16,节日_IDM,ALL,https://images.heaton.com.cn/download/675bdcdf066211.08277179,library_16/holiday/15804.gif,hand-gift,A hand holding a blue gift box on a white background. Gift-giving motif.
holiday,15805,gif,16,16,节日_IDM,ALL,https://images.heaton.com.cn/download/675bdcdf066247.74004311,library_16/holiday/15805.gif,gray-spider,A gray spider/crab on a dark background. Creepy crawler.
holiday,15806,gif,16,16,节日_IDM,ALL,https://images.heaton.com.cn/download/675bdcdf066288.03655206,library_16/holiday/15806.gif,candle-2,A small white candle on a dark background. Light motif.
holiday,15807,gif,16,16,节日_IDM,ALL,https://images.heaton.com.cn/download/675bdcdf0662e8.25073484,library_16/holiday/15807.gif,blue-blank,A solid blue square. Minimal color block.
holiday,15808,gif,16,16,节日_IDM,ALL,https://images.heaton.com.cn/download/675bdcdf066329.16713706,library_16/holiday/15808.gif,bandage-heart,A red heart with a bandage on a pink background. Healing/mending love.
holiday,15809,gif,16,16,节日_IDM,ALL,https://images.heaton.com.cn/download/675bdcdf066356.92526699,library_16/holiday/15809.gif,teddy-bear,A brown teddy bear with a heart on a dark background. Affectionate plush.
holiday,15810,gif,16,16,节日_IDM,ALL,https://images.heaton.com.cn/download/675bdcdf066392.92373174,library_16/holiday/15810.gif,pink-camera,A pink retro camera on a pink background. Photography icon.
holiday,15811,gif,16,16,节日_IDM,ALL,https://images.heaton.com.cn/download/675bdcdf0663d8.71488066,library_16/holiday/15811.gif,green-grid,A grid of green-and-gray squares on a dark background. Pixel pattern.
holiday,15812,gif,16,16,节日_IDM,ALL,https://images.heaton.com.cn/download/675bdcdf066410.69315147,library_16/holiday/15812.gif,dark-scene,A mostly dark scene with a small orange accent. Near-empty frame.
holiday,15813,gif,16,16,节日_IDM,ALL,https://images.heaton.com.cn/download/675bdcdf066455.05741665,library_16/holiday/15813.gif,pink-heart-2,A pink-and-white heart on a blue background. Love icon.
holiday,15814,gif,16,16,节日_IDM,ALL,https://images.heaton.com.cn/download/675bdcdf0664b4.93468836,library_16/holiday/15814.gif,skull-hearts,A white skull surrounded by little hearts on dark. Spooky-love motif.
holiday,15815,gif,16,16,节日_IDM,ALL,https://images.heaton.com.cn/download/675bdcdf0664e6.16404709,library_16/holiday/15815.gif,red-heart-3,A red heart with green accents on a purple background. Love symbol.
holiday,15816,gif,16,16,节日_IDM,ALL,https://images.heaton.com.cn/download/675bdcdf066520.03896768,library_16/holiday/15816.gif,cupid-heart-2,A brown heart struck by an arrow on a dark background. Cupid's-arrow motif.
holiday,15817,gif,16,16,节日_IDM,ALL,https://images.heaton.com.cn/download/675bdcdf066565.59659629,library_16/holiday/15817.gif,cupcake,A pink cupcake on a purple background. Sweet treat.
holiday,15818,gif,16,16,节日_IDM,ALL,https://images.heaton.com.cn/download/675bdcdf066595.41070567,library_16/holiday/15818.gif,love-letter,An envelope with a heart on a tan background. Love-letter motif.
holiday,15819,gif,16,16,节日_IDM,ALL,https://images.heaton.com.cn/download/675bdcdf0665d7.84672070,library_16/holiday/15819.gif,two-hearts,Two pink hearts on a blue background. Love-struck motif.
holiday,15820,gif,16,16,节日_IDM,ALL,https://images.heaton.com.cn/download/675bdcdf066632.29047817,library_16/holiday/15820.gif,couple,A man and woman couple on a pink background. Romance scene.
holiday,15821,gif,16,16,节日_IDM,ALL,https://images.heaton.com.cn/download/675bdcdf066675.05925252,library_16/holiday/15821.gif,bunny-heart,A gray rabbit with a heart on a pink background. Cute love motif.
holiday,15822,gif,16,16,节日_IDM,ALL,https://images.heaton.com.cn/download/675bdcdf0666b7.06710427,library_16/holiday/15822.gif,green-bar,A green vertical bar/light on a black background. Minimal indicator.
holiday,15823,gif,16,16,节日_IDM,ALL,https://images.heaton.com.cn/download/675bdcdf0666e7.01907923,library_16/holiday/15823.gif,night-bat,A bat in a snowy night scene on a dark background. Spooky-winter motif.
holiday,15824,gif,16,16,节日_IDM,ALL,https://images.heaton.com.cn/download/675bdcdf066727.11356275,library_16/holiday/15824.gif,red-rose-2,A red rose flower in a small landscape. Floral motif.
holiday,15825,gif,16,16,节日_IDM,ALL,https://images.heaton.com.cn/download/675bdcdf066766.81368896,library_16/holiday/15825.gif,gray-creature,A gray cat/bat face on a dark background. Spooky animal.
holiday,15826,gif,16,16,节日_IDM,ALL,https://images.heaton.com.cn/download/675bdcdf0667a8.48277752,library_16/holiday/15826.gif,red-heart-4,A red 3D heart on a blue background. Love symbol.
holiday,15827,gif,16,16,节日_IDM,ALL,https://images.heaton.com.cn/download/675bdcdf066818.29904427,library_16/holiday/15827.gif,dove,A white dove/bird with a heart on a pink background. Peace/love motif.
holiday,15828,gif,16,16,节日_IDM,ALL,https://images.heaton.com.cn/download/675bdcdf066851.12403718,library_16/holiday/15828.gif,pink-fish,A pink fish/creature on a dark background. Aquatic motif.
holiday,15829,gif,16,16,节日_IDM,ALL,https://images.heaton.com.cn/download/675bdcdf066898.99087649,library_16/holiday/15829.gif,computer,An old computer/monitor on a purple background. Retro device.
holiday,15830,gif,16,16,节日_IDM,ALL,https://images.heaton.com.cn/download/675bdcdf0668e9.46087039,library_16/holiday/15830.gif,calendar,A calendar/list page on a tan background. Schedule motif.
holiday,15831,gif,16,16,节日_IDM,ALL,https://images.heaton.com.cn/download/675bdcdf066941.61155679,library_16/holiday/15831.gif,cupid,A winged cupid with a bow on a blue background. Valentine cherub.
holiday,15832,gif,16,16,节日_IDM,ALL,https://images.heaton.com.cn/download/675bdcdf0669a9.34635633,library_16/holiday/15832.gif,pink-monster-2,A pink monster/cat with heart eyes on pink. Love-struck creature.
holiday,15833,gif,16,16,节日_IDM,ALL,https://images.heaton.com.cn/download/675bdcdf066a24.78081271,library_16/holiday/15833.gif,pink-gift,A gift box in a pink frame on a magenta background. Present motif.
holiday,15834,gif,16,16,节日_IDM,ALL,https://images.heaton.com.cn/download/675bdcdf066a80.39937660,library_16/holiday/15834.gif,pink-heart-3,A pink-and-orange heart on a dark background. Love icon.
holiday,15835,gif,16,16,节日_IDM,ALL,https://images.heaton.com.cn/download/675bdcdf066ae2.31098908,library_16/holiday/15835.gif,new-text,The word 'NEW' in green on a gray background. Promo text.
holiday,15836,gif,16,16,节日_IDM,ALL,https://images.heaton.com.cn/download/675bdcdf066b20.82951602,library_16/holiday/15836.gif,jack-o-lantern-3,A glowing jack-o'-lantern on a dark background. Halloween pumpkin.
holiday,15837,gif,16,16,节日_IDM,ALL,https://images.heaton.com.cn/download/675bdcdf066b63.02044365,library_16/holiday/15837.gif,dark-heart,A dark heart with an arrow on a dark background. Moody love motif.
holiday,15838,gif,16,16,节日_IDM,ALL,https://images.heaton.com.cn/download/675bdcdf066ba0.41553873,library_16/holiday/15838.gif,house-2,A house with a red roof on a gray background. Home icon.
holiday,15839,gif,16,16,节日_IDM,ALL,https://images.heaton.com.cn/download/675bdcdf066be3.85344994,library_16/holiday/15839.gif,year-2023,The numbers '2023' on a dark background. New-year motif.
holiday,15840,gif,16,16,节日_IDM,ALL,https://images.heaton.com.cn/download/675bdcdf066c41.31751935,library_16/holiday/15840.gif,santa-kid,A child in a Santa hat on a blue background. Festive kid.
holiday,15841,gif,16,16,节日_IDM,ALL,https://images.heaton.com.cn/download/675bdcdf066c83.15335208,library_16/holiday/15841.gif,santa-trees,Santa Claus among Christmas trees on a dark background. Holiday scene.
holiday,15842,gif,16,16,节日_IDM,ALL,https://images.heaton.com.cn/download/675bdcdf066cc4.41740272,library_16/holiday/15842.gif,santa-4,A red-suited Santa Claus on a green background. Christmas mascot.
holiday,15843,gif,16,16,节日_IDM,ALL,https://images.heaton.com.cn/download/675bdcdf066cf1.07740768,library_16/holiday/15843.gif,santa-gnome,A white-bearded Santa/gnome face on a cream background. Festive character.
holiday,15844,gif,16,16,节日_IDM,ALL,https://images.heaton.com.cn/download/675bdcdf066d30.38698311,library_16/holiday/15844.gif,snow-house,A house with a red roof and snow on a dark background. Winter home.
holiday,15845,gif,16,16,节日_IDM,ALL,https://images.heaton.com.cn/download/675bdcdf066d76.91867868,library_16/holiday/15845.gif,santa-5,A standing Santa Claus on a dark background. Christmas character.
holiday,15846,gif,16,16,节日_IDM,ALL,https://images.heaton.com.cn/download/675bdcdf066dd6.20664111,library_16/holiday/15846.gif,pink-hearts,A pattern of pink hearts on a pink background. Love motif.
holiday,15847,gif,16,16,节日_IDM,ALL,https://images.heaton.com.cn/download/675bdcdf066e17.60007676,library_16/holiday/15847.gif,gold-heart,A glowing gold heart on a dark background. Shiny love icon.
holiday,15848,gif,16,16,节日_IDM,ALL,https://images.heaton.com.cn/download/675bdcdf066e56.58166338,library_16/holiday/15848.gif,pink-heart-4,A pink heart on a dark background. Love icon.
holiday,15849,gif,16,16,节日_IDM,ALL,https://images.heaton.com.cn/download/675bdcdf066e90.18165816,library_16/holiday/15849.gif,yellow-heart,A yellow 3D heart on a dark background. Love icon.
holiday,15850,gif,16,16,节日_IDM,ALL,https://images.heaton.com.cn/download/675bdcdf066ed8.76830223,library_16/holiday/15850.gif,red-heart-5,A red 3D heart on an orange background. Love symbol.
holiday,15851,gif,16,16,节日_IDM,ALL,https://images.heaton.com.cn/download/675bdcdf066f10.67451858,library_16/holiday/15851.gif,santa-face,A bearded Santa face on a dark background. Christmas portrait.
holiday,15852,gif,16,16,节日_IDM,ALL,https://images.heaton.com.cn/download/675bdcdf066f55.17113699,library_16/holiday/15852.gif,santa-boy,A boy in a Santa hat on a dark background. Festive kid.
holiday,15853,gif,16,16,节日_IDM,ALL,https://images.heaton.com.cn/download/675bdcdf066fb7.13970991,library_16/holiday/15853.gif,red-gift,A red gift box with greenery on a dark background. Present motif.
holiday,15854,gif,16,16,节日_IDM,ALL,https://images.heaton.com.cn/download/675bdcdf066ff3.69581999,library_16/holiday/15854.gif,red-white-heart,A red-and-white heart on a dark background. Love symbol.
holiday,15855,gif,16,16,节日_IDM,ALL,https://images.heaton.com.cn/download/675bdcdf067034.35880992,library_16/holiday/15855.gif,zombie-witch,A green zombie in a witch hat on a dark background. Halloween monster.
holiday,15856,gif,16,16,节日_IDM,ALL,https://images.heaton.com.cn/download/675bdcdf067078.21638701,library_16/holiday/15856.gif,santa-6,A red-suited Santa Claus on a blue background. Christmas mascot.
holiday,15857,gif,16,16,节日_IDM,ALL,https://images.heaton.com.cn/download/675bdcdf0670b2.72838438,library_16/holiday/15857.gif,reindeer,A reindeer face with a red nose on a dark background. Rudolph motif.
holiday,15858,gif,16,16,节日_IDM,ALL,https://images.heaton.com.cn/download/675bdcdf0670e8.50289000,library_16/holiday/15858.gif,santa-hat-2,A red Santa hat on a blue background. Festive headwear.
holiday,15859,gif,16,16,节日_IDM,ALL,https://images.heaton.com.cn/download/675bdcdf067141.08134940,library_16/holiday/15859.gif,santa-kid-2,A child in a red Santa outfit on a dark background. Festive kid.
holiday,15860,gif,16,16,节日_IDM,ALL,https://images.heaton.com.cn/download/675bdcdf067191.71136314,library_16/holiday/15860.gif,santa-7,A standing Santa Claus on a dark background. Christmas character.
holiday,15861,gif,16,16,节日_IDM,ALL,https://images.heaton.com.cn/download/675bdcdf0671d6.16782511,library_16/holiday/15861.gif,gifts,A pile of wrapped presents on a dark background. Gift motif.
holiday,15862,gif,16,16,节日_IDM,ALL,https://images.heaton.com.cn/download/675bdcdf067219.31940093,library_16/holiday/15862.gif,deer-face,An orange reindeer/deer face on a cream background. Antlered animal.
holiday,15863,gif,16,16,节日_IDM,ALL,https://images.heaton.com.cn/download/675bdcdf067251.44447607,library_16/holiday/15863.gif,snowman-gift,A snowman with a yellow gift on a blue background. Winter scene.
holiday,15864,gif,16,16,节日_IDM,ALL,https://images.heaton.com.cn/download/675bdcdf067291.01800111,library_16/holiday/15864.gif,xmas-tree-3,A decorated Christmas tree on a tan background. Festive evergreen.
holiday,15865,gif,16,16,节日_IDM,ALL,https://images.heaton.com.cn/download/675bdcdf0672d0.04654037,library_16/holiday/15865.gif,tree-3,A green Christmas tree on a white background. Evergreen.
holiday,15866,gif,16,16,节日_IDM,ALL,https://images.heaton.com.cn/download/675bdcdf067335.51476667,library_16/holiday/15866.gif,snowman-4,A white snowman on a teal background. Winter character.
holiday,15867,gif,16,16,节日_IDM,ALL,https://images.heaton.com.cn/download/675bdcdf067375.27233927,library_16/holiday/15867.gif,santa-face-2,A white-bearded Santa face on a gray background. Christmas portrait.
holiday,15868,gif,16,16,节日_IDM,ALL,https://images.heaton.com.cn/download/675bdcdf0673b1.73670148,library_16/holiday/15868.gif,xmas-window,A decorated room/window with Christmas lights on dark. Festive interior.
holiday,15869,gif,16,16,节日_IDM,ALL,https://images.heaton.com.cn/download/675bdcdf0673f5.52978570,library_16/holiday/15869.gif,xmas-tree-4,A Christmas tree with ornaments on a dark background. Festive evergreen.
holiday,15870,gif,16,16,节日_IDM,ALL,https://images.heaton.com.cn/download/675bdcdf067438.87252392,library_16/holiday/15870.gif,snow-globe,A snow globe with a house inside on a dark background. Wintry keepsake.
holiday,15871,gif,16,16,节日_IDM,ALL,https://images.heaton.com.cn/download/675bdcdf067460.59281296,library_16/holiday/15871.gif,field,A green-and-tan landscape/field. Minimal outdoor scene.
holiday,15872,gif,16,16,节日_IDM,ALL,https://images.heaton.com.cn/download/675bdcdf0674a8.67829315,library_16/holiday/15872.gif,sword,A sword/cross with snow on a dark background. Weapon motif.
holiday,15873,gif,16,16,节日_IDM,ALL,https://images.heaton.com.cn/download/675bdcdf067500.62719964,library_16/holiday/15873.gif,wreath-2,A green Christmas wreath on a cyan background. Holiday decoration.
holiday,15874,gif,16,16,节日_IDM,ALL,https://images.heaton.com.cn/download/675bdcdf067540.01810561,library_16/holiday/15874.gif,pink-heart-5,A pink 3D heart on a pink background. Love icon.
holiday,15875,gif,16,16,节日_IDM,ALL,https://images.heaton.com.cn/download/675bdcdf067574.11022256,library_16/holiday/15875.gif,ice-cream-santa,An ice cream cone with a Santa hat on a dark background. Festive treat.
holiday,15876,gif,16,16,节日_IDM,ALL,https://images.heaton.com.cn/download/675bdcdf0675b6.18121555,library_16/holiday/15876.gif,santa-person,A person in a Santa hat on a dark background. Festive figure.
holiday,15877,gif,16,16,节日_IDM,ALL,https://images.heaton.com.cn/download/675bdcdf0675f0.86808747,library_16/holiday/15877.gif,pink-pig,A pink pig/creature in a Santa hat on a purple background. Festive animal.
holiday,15878,gif,16,16,节日_IDM,ALL,https://images.heaton.com.cn/download/675bdcdf067639.01458872,library_16/holiday/15878.gif,skull-red-eyes,A white skull with red eyes on a dark background. Spooky motif.
holiday,15879,gif,16,16,节日_IDM,ALL,https://images.heaton.com.cn/download/675bdcdf067682.20864634,library_16/holiday/15879.gif,clown-face,A white clown/joker face with a creepy grin on dark. Unsettling character.
holiday,15880,gif,16,16,节日_IDM,ALL,https://images.heaton.com.cn/download/675bdcdf0676d6.56716119,library_16/holiday/15880.gif,yellow-blob,A yellow face/blob with little hearts on a dark background. Cute creature.
