category,file_id,format,width,height,category_name,label,file_path,local,name,description
all,31977,png,64,64,iDotMatrix,ALL,https://images.heaton.com.cn/download/686b4469aa8141.55867784,library_images_64/all/31977.png,covering-face,"A face partly covered by hands, peek-a-boo style. Reaction image."
all,31978,png,64,64,iDotMatrix,ALL,https://images.heaton.com.cn/download/686b4469aa8205.27152124,library_images_64/all/31978.png,facepalm-man,"An old man covering his eyes/face, facepalm style. Reaction image."
all,23575,png,64,64,iDotMatrix,ALL,https://images.heaton.com.cn/download/675bdcdf136178.03920127,library_images_64/all/23575.png,ufo-beam,A UFO abducting with a beam of light at night. Alien scene.
all,23576,png,64,64,iDotMatrix,ALL,https://images.heaton.com.cn/download/675bdcdf1361e2.68555243,library_images_64/all/23576.png,desert-sunset,A desert/canyon landscape at sunset. Scenic vista.
all,23577,png,64,64,iDotMatrix,ALL,https://images.heaton.com.cn/download/675bdcdf136245.26758840,library_images_64/all/23577.png,red-canyon,A red desert/canyon under a bright sun. Scenic landscape.
all,23578,png,64,64,iDotMatrix,ALL,https://images.heaton.com.cn/download/675bdcdf1362b7.26884013,library_images_64/all/23578.png,sakura-tree,A pink cherry-blossom tree in full bloom. Spring scene.
all,23579,png,64,64,iDotMatrix,ALL,https://images.heaton.com.cn/download/675bdcdf136316.39553980,library_images_64/all/23579.png,moon-clouds,A blue moon among clouds in a starry sky. Dreamy night scene.
all,23580,png,64,64,iDotMatrix,ALL,https://images.heaton.com.cn/download/675bdcdf1363a8.94126436,library_images_64/all/23580.png,mushroom-house,A mushroom-shaped house at night. Fairy-tale dwelling.
all,23581,png,64,64,iDotMatrix,ALL,https://images.heaton.com.cn/download/675bdcdf136412.65338445,library_images_64/all/23581.png,dark-castle,A dark castle silhouetted at night. Spooky scene.
all,23582,png,64,64,iDotMatrix,ALL,https://images.heaton.com.cn/download/675bdcdf136472.67632942,library_images_64/all/23582.png,dusk-city,A purple city silhouette at dusk. Urban skyline.
all,23583,png,64,64,iDotMatrix,ALL,https://images.heaton.com.cn/download/675bdcdf1364d2.66023591,library_images_64/all/23583.png,hot-air-balloon,A hot air balloon drifting over mountains. Scenic travel scene.
all,23584,png,64,64,iDotMatrix,ALL,https://images.heaton.com.cn/download/675bdcdf136530.78198754,library_images_64/all/23584.png,purple-skyline,A purple city skyline. Urban vista.
all,23585,png,64,64,iDotMatrix,ALL,https://images.heaton.com.cn/download/675bdcdf1365a7.71992446,library_images_64/all/23585.png,lighthouse,A lighthouse standing on a coastal cliff. Seaside scene.
all,23586,png,64,64,iDotMatrix,ALL,https://images.heaton.com.cn/download/675bdcdf136600.08952654,library_images_64/all/23586.png,red-train,A red train at night. Railway scene.
all,23587,png,64,64,iDotMatrix,ALL,https://images.heaton.com.cn/download/675bdcdf136692.47094743,library_images_64/all/23587.png,party-cat,An orange cat wearing a party hat. Festive pet.
all,23588,png,64,64,iDotMatrix,ALL,https://images.heaton.com.cn/download/675bdcdf1366f1.26269257,library_images_64/all/23588.png,purple-bat,A purple bat/creature face. Spooky animal.
all,23589,png,64,64,iDotMatrix,ALL,https://images.heaton.com.cn/download/675bdcdf136755.66002223,library_images_64/all/23589.png,gray-cat-2,A gray cat with big eyes. Feline portrait.
all,23590,png,64,64,iDotMatrix,ALL,https://images.heaton.com.cn/download/675bdcdf1367c3.80209139,library_images_64/all/23590.png,box-dog,A dog peeking out of a box/costume. Cute pet scene.
all,23591,png,64,64,iDotMatrix,ALL,https://images.heaton.com.cn/download/675bdcdf136823.67121494,library_images_64/all/23591.png,hugging-cats,Two gray cats hugging with a heart. Affectionate pet scene.
all,23592,png,64,64,iDotMatrix,ALL,https://images.heaton.com.cn/download/675bdcdf136881.50758040,library_images_64/all/23592.png,eye-of-horus,"An Eye of Horus, the Egyptian symbol. Ancient motif."
all,23593,png,64,64,iDotMatrix,ALL,https://images.heaton.com.cn/download/675bdcdf136918.62580729,library_images_64/all/23593.png,synthwave-road-2,A synthwave road leading to a neon sunset. Vaporwave scene.
all,23594,png,64,64,iDotMatrix,ALL,https://images.heaton.com.cn/download/675bdcdf136973.49934988,library_images_64/all/23594.png,saturn,The ringed planet Saturn in colorful space. Cosmic vista.
all,23595,png,64,64,iDotMatrix,ALL,https://images.heaton.com.cn/download/675bdcdf1369d0.31039154,library_images_64/all/23595.png,monster-mouth,A dark monster's toothy mouth. Spooky creature.
all,23596,png,64,64,iDotMatrix,ALL,https://images.heaton.com.cn/download/675bdcdf136a43.72891092,library_images_64/all/23596.png,robot-factory,A robot/factory machinery scene. Industrial mechanical vignette.
all,23597,png,64,64,iDotMatrix,ALL,https://images.heaton.com.cn/download/675bdcdf136aa8.67766855,library_images_64/all/23597.png,green-record-2,A green vinyl record with a character. Music motif.
all,23598,png,64,64,iDotMatrix,ALL,https://images.heaton.com.cn/download/675bdcdf136b18.10075296,library_images_64/all/23598.png,love-text,'LOVE' in glowing neon letters. Valentine motif.
all,23599,png,64,64,iDotMatrix,ALL,https://images.heaton.com.cn/download/675bdcdf136b74.24532079,library_images_64/all/23599.png,cheshire-grin-2,A purple Cheshire-cat-style creepy grin. Mischievous emoji.
all,23600,png,64,64,iDotMatrix,ALL,https://images.heaton.com.cn/download/675bdcdf136c11.21054125,library_images_64/all/23600.png,arcade-kid,A boy playing at an arcade machine. Gaming scene.
all,23601,png,64,64,iDotMatrix,ALL,https://images.heaton.com.cn/download/675bdcdf136c77.39293535,library_images_64/all/23601.png,gengar,"Gengar, the purple grinning Ghost-type Pokemon. Game character."
all,23602,png,64,64,iDotMatrix,ALL,https://images.heaton.com.cn/download/675bdcdf136ce1.59630977,library_images_64/all/23602.png,no-smoking-2,A no-smoking sign with a crossed-out cigarette. Warning signage.
all,23603,png,64,64,iDotMatrix,ALL,https://images.heaton.com.cn/download/675bdcdf136d45.95971843,library_images_64/all/23603.png,question-block,A Mario '?' question block. Game item.
all,23604,png,64,64,iDotMatrix,ALL,https://images.heaton.com.cn/download/675bdcdf136da0.62776214,library_images_64/all/23604.png,purple-bat-2,A purple bat on a dark background. Spooky animal.
all,23605,png,64,64,iDotMatrix,ALL,https://images.heaton.com.cn/download/675bdcdf136e06.32644252,library_images_64/all/23605.png,music-note,A black music note on cyan. Music motif.
all,23606,png,64,64,iDotMatrix,ALL,https://images.heaton.com.cn/download/675bdcdf136eb3.13720206,library_images_64/all/23606.png,burger-2,A loaded hamburger. Fast-food icon.
all,23607,png,64,64,iDotMatrix,ALL,https://images.heaton.com.cn/download/675bdcdf136f17.54859785,library_images_64/all/23607.png,green-zombie,A green zombie/monster face. Spooky creature.
all,23608,png,64,64,iDotMatrix,ALL,https://images.heaton.com.cn/download/675bdcdf136f84.77304604,library_images_64/all/23608.png,daffodils,Daffodils/flowers by a window. Floral scene.
all,23609,png,64,64,iDotMatrix,ALL,https://images.heaton.com.cn/download/675bdcdf136fe4.41004292,library_images_64/all/23609.png,robot-smiley,A gray robot/computer with a smiley face. Friendly bot.
all,23610,png,64,64,iDotMatrix,ALL,https://images.heaton.com.cn/download/675bdcdf137057.26893996,library_images_64/all/23610.png,rainbow-alien,A rainbow alien/UFO creature. Colorful extraterrestrial.
all,23611,png,64,64,iDotMatrix,ALL,https://images.heaton.com.cn/download/675bdcdf1370c2.87312829,library_images_64/all/23611.png,pink-village,A pink Christmas village. Festive scene.
all,23612,png,64,64,iDotMatrix,ALL,https://images.heaton.com.cn/download/675bdcdf137126.99374894,library_images_64/all/23612.png,pink-hamster,A pink hamster/pig character. Cute animal.
all,23613,png,64,64,iDotMatrix,ALL,https://images.heaton.com.cn/download/675bdcdf1371d9.35244216,library_images_64/all/23613.png,bee-2,A yellow-and-black bee. Insect motif.
all,23614,png,64,64,iDotMatrix,ALL,https://images.heaton.com.cn/download/675bdcdf137241.63212276,library_images_64/all/23614.png,black-ghost,A black ghost with glowing yellow eyes. Halloween spirit.
all,23615,png,64,64,iDotMatrix,ALL,https://images.heaton.com.cn/download/675bdcdf1372a1.87443843,library_images_64/all/23615.png,masked-face,A white masked face on dark. Creepy portrait.
all,23616,png,64,64,iDotMatrix,ALL,https://images.heaton.com.cn/download/675bdcdf137303.20401637,library_images_64/all/23616.png,game-room-sign,A 'GAME ROOM' neon sign. Arcade signage.
all,23617,png,64,64,iDotMatrix,ALL,https://images.heaton.com.cn/download/675bdcdf137369.18060455,library_images_64/all/23617.png,cpu,A green circuit board with a 'CPU' chip. Computer-hardware motif.
all,23618,png,64,64,iDotMatrix,ALL,https://images.heaton.com.cn/download/675bdcdf1373d8.64987629,library_images_64/all/23618.png,saturn-2,The ringed planet Saturn in space. Cosmic motif.
all,23619,png,64,64,iDotMatrix,ALL,https://images.heaton.com.cn/download/675bdcdf137438.16151624,library_images_64/all/23619.png,color-blocks,A colorful mosaic of blocks/Tetris pieces. Geometric pattern.
all,23620,png,64,64,iDotMatrix,ALL,https://images.heaton.com.cn/download/675bdcdf1374c5.69164042,library_images_64/all/23620.png,whale-heart,A whale with a heart among clouds. Whimsical sky scene.
all,23621,png,64,64,iDotMatrix,ALL,https://images.heaton.com.cn/download/675bdcdf137527.28469969,library_images_64/all/23621.png,blue-box-bot,A blue box-shaped robot face on red. Blocky character.
all,23622,png,64,64,iDotMatrix,ALL,https://images.heaton.com.cn/download/675bdcdf137585.00241333,library_images_64/all/23622.png,wifi-connected,A WiFi symbol with 'CONECTED!!!' text. Connectivity graphic.
all,23624,png,64,64,iDotMatrix,ALL,https://images.heaton.com.cn/download/675bdcdf137655.35363778,library_images_64/all/23624.png,flaming-heart,A red heart engulfed in flames. Fiery passion motif.
all,23625,png,64,64,iDotMatrix,ALL,https://images.heaton.com.cn/download/675bdcdf1376c8.33890912,library_images_64/all/23625.png,yellow-birds,A pattern of little yellow birds/chicks. Cute flock motif.
all,23626,png,64,64,iDotMatrix,ALL,https://images.heaton.com.cn/download/675bdcdf137742.14783989,library_images_64/all/23626.png,teddy-bear,A brown teddy bear. Cuddly toy.
all,23627,png,64,64,iDotMatrix,ALL,https://images.heaton.com.cn/download/675bdcdf1377b7.34349848,library_images_64/all/23627.png,sorceress,A purple witch/sorceress character. Fantasy figure.
all,23628,png,64,64,iDotMatrix,ALL,https://images.heaton.com.cn/download/675bdcdf137823.15473437,library_images_64/all/23628.png,skull-drink,A green skull-shaped cocktail/poison drink. Spooky beverage.
all,23629,png,64,64,iDotMatrix,ALL,https://images.heaton.com.cn/download/675bdcdf137884.10218273,library_images_64/all/23629.png,alien-landscape,A cosmic alien landscape with planets. Sci-fi vista.
all,23631,png,64,64,iDotMatrix,ALL,https://images.heaton.com.cn/download/675bdcdf1378e1.92451464,library_images_64/all/23631.png,icon-tree,A robot beside a tree of app icons. Tech-themed scene.
all,23632,png,64,64,iDotMatrix,ALL,https://images.heaton.com.cn/download/675bdcdf137941.01473414,library_images_64/all/23632.png,red-tank,A red tank/military vehicle. War-machine motif.
all,23633,png,64,64,iDotMatrix,ALL,https://images.heaton.com.cn/download/675bdcdf1379a7.35496608,library_images_64/all/23633.png,dragon-eye,A dark dragon/monster with a glowing eye. Fantasy creature.
all,23634,png,64,64,iDotMatrix,ALL,https://images.heaton.com.cn/download/675bdcdf137a34.30205262,library_images_64/all/23634.png,carriage,A horse-drawn carriage at night. Old-world travel scene.
all,23635,png,64,64,iDotMatrix,ALL,https://images.heaton.com.cn/download/675bdcdf137a90.37440788,library_images_64/all/23635.png,sun-face,A golden sun with a face. Celestial motif.
all,23636,png,64,64,iDotMatrix,ALL,https://images.heaton.com.cn/download/675bdcdf137b04.33845502,library_images_64/all/23636.png,green-alien-2,A green alien/creature. Quirky extraterrestrial.
all,23637,png,64,64,iDotMatrix,ALL,https://images.heaton.com.cn/download/675bdcdf137bf8.54870828,library_images_64/all/23637.png,dark-witch,A dark witch/cloaked figure. Halloween character.
all,23638,png,64,64,iDotMatrix,ALL,https://images.heaton.com.cn/download/675bdcdf137c57.46429451,library_images_64/all/23638.png,office-desk,A person working at an office desk. Workplace scene.
all,23639,png,64,64,iDotMatrix,ALL,https://images.heaton.com.cn/download/675bdcdf137cc3.70796802,library_images_64/all/23639.png,alarm-clock,A red alarm clock. Time/wake-up icon.
all,23640,png,64,64,iDotMatrix,ALL,https://images.heaton.com.cn/download/675bdcdf137d52.21343174,library_images_64/all/23640.png,rose-runner,"A green figure carrying a rose, Nyan-style. Whimsical character."
all,23641,png,64,64,iDotMatrix,ALL,https://images.heaton.com.cn/download/675bdcdf137db3.74305394,library_images_64/all/23641.png,no-bubble,'NO' in a red speech bubble. Refusal motif.
all,23642,png,64,64,iDotMatrix,ALL,https://images.heaton.com.cn/download/675bdcdf137e23.25541717,library_images_64/all/23642.png,sound-system,A DJ/sound-system stage scene. Music-party vignette.
all,23643,png,64,64,iDotMatrix,ALL,https://images.heaton.com.cn/download/675bdcdf137e80.72240193,library_images_64/all/23643.png,blue-cat,A blue cat in a doorway. Feline scene.
all,23644,png,64,64,iDotMatrix,ALL,https://images.heaton.com.cn/download/675bdcdf137ee9.41219479,library_images_64/all/23644.png,las-vegas,A 'Welcome to Fabulous Las Vegas' sign. Landmark signage.
all,23646,png,64,64,iDotMatrix,ALL,https://images.heaton.com.cn/download/675bdcdf137fb8.75504428,library_images_64/all/23646.png,dungeon-altar,A dark dungeon/altar room. Game-level scene.
all,23647,png,64,64,iDotMatrix,ALL,https://images.heaton.com.cn/download/675bdcdf138040.61354113,library_images_64/all/23647.png,sunset-car,A sports car at sunset. Scenic drive.
all,23648,png,64,64,iDotMatrix,ALL,https://images.heaton.com.cn/download/675bdcdf1380a3.77729022,library_images_64/all/23648.png,spooky-night,A spooky night landscape with bare trees. Halloween scene.
all,23649,png,64,64,iDotMatrix,ALL,https://images.heaton.com.cn/download/675bdcdf138117.85938459,library_images_64/all/23649.png,green-slime,A green slime/monster. Cute RPG creature.
all,23650,png,64,64,iDotMatrix,ALL,https://images.heaton.com.cn/download/675bdcdf138171.26502061,library_images_64/all/23650.png,superheroes,Two superheroes in red and blue. Comic-book scene.
all,23651,png,64,64,iDotMatrix,ALL,https://images.heaton.com.cn/download/675bdcdf1381e0.90028750,library_images_64/all/23651.png,ss-coin,A green coin/face marked 'SS'. Token motif.
all,23652,png,64,64,iDotMatrix,ALL,https://images.heaton.com.cn/download/675bdcdf138241.59724672,library_images_64/all/23652.png,pink-computer,A pink computer/robot face character. Cute tech mascot.
all,23653,png,64,64,iDotMatrix,ALL,https://images.heaton.com.cn/download/675bdcdf1382d1.62937125,library_images_64/all/23653.png,rose-bouquet,A bouquet of red roses. Floral gift motif.
all,23654,png,64,64,iDotMatrix,ALL,https://images.heaton.com.cn/download/675bdcdf138345.67913037,library_images_64/all/23654.png,blue-pokeball,A blue Pokeball/eye device. Game item.
all,23655,png,64,64,iDotMatrix,ALL,https://images.heaton.com.cn/download/675bdcdf1383a8.65445809,library_images_64/all/23655.png,race-road,A racing-game road scene. Arcade racer.
all,23656,png,64,64,iDotMatrix,ALL,https://images.heaton.com.cn/download/675bdcdf138408.97815396,library_images_64/all/23656.png,samus-2,Samus from Metroid running in her armor. Game character.
all,23657,png,64,64,iDotMatrix,ALL,https://images.heaton.com.cn/download/675bdcdf138471.85217364,library_images_64/all/23657.png,pop-collage,A colorful abstract pop-art collage. Vibrant design.
all,23658,png,64,64,iDotMatrix,ALL,https://images.heaton.com.cn/download/675bdcdf1384d8.98055721,library_images_64/all/23658.png,couple,Two people standing together. Couple/friends scene.
all,23659,png,64,64,iDotMatrix,ALL,https://images.heaton.com.cn/download/675bdcdf138538.60391470,library_images_64/all/23659.png,birthday-cake,A birthday cake with balloons. Celebration scene.
