category,file_id,format,width,height,category_name,label,file_path,local,name,description
holiday,15881,gif,16,16,节日_IDM,ALL,https://images.heaton.com.cn/download/675bdcdf067705.09594908,library_16/holiday/15881.gif,heart-outline-2,A red heart outline on a dark background. Simple love icon.
holiday,15882,gif,16,16,节日_IDM,ALL,https://images.heaton.com.cn/download/675bdcdf067740.86989879,library_16/holiday/15882.gif,confetti,A colorful party scene with confetti on a dark background. Celebration motif.
holiday,15883,gif,16,16,节日_IDM,ALL,https://images.heaton.com.cn/download/675bdcdf067783.20757071,library_16/holiday/15883.gif,pink-heart-6,A pink 3D heart on a dark background. Love icon.
holiday,15884,gif,16,16,节日_IDM,ALL,https://images.heaton.com.cn/download/675bdcdf0677c6.19652336,library_16/holiday/15884.gif,pink-heart-7,A pink heart on a pink background. Love icon.
holiday,15885,gif,16,16,节日_IDM,ALL,https://images.heaton.com.cn/download/675bdcdf067805.11419442,library_16/holiday/15885.gif,light-heart,A heart outlined in colorful lights on a dark background. Festive love decoration.
holiday,15886,gif,16,16,节日_IDM,ALL,https://images.heaton.com.cn/download/675bdcdf067863.98480314,library_16/holiday/15886.gif,pink-drip,A pink melting/drip scene on a pink background. Abstract motif.
holiday,15887,gif,16,16,节日_IDM,ALL,https://images.heaton.com.cn/download/675bdcdf0678a6.87872645,library_16/holiday/15887.gif,purple-gem,A pink-purple gem/crystal on a dark background. Jewel motif.
holiday,15888,gif,16,16,节日_IDM,ALL,https://images.heaton.com.cn/download/675bdcdf0678e2.39997624,library_16/holiday/15888.gif,black-mask,A black skull/mask on a teal background. Spooky face.
holiday,15889,gif,16,16,节日_IDM,ALL,https://images.heaton.com.cn/download/675bdcdf067928.76445933,library_16/holiday/15889.gif,maroon-hill,A dark red hill/wave shape on a dark background. Abstract form.
holiday,15890,gif,16,16,节日_IDM,ALL,https://images.heaton.com.cn/download/675bdcdf067969.49750196,library_16/holiday/15890.gif,love-face,A pink face with heart eyes on a pink background. Love-struck emoji.
emoji,32705,gif,16,16,表情_IDM,ALL,https://images.heaton.com.cn/download/6889d8a2a8d695.85621996,library_16/emoji/32705.gif,content-face,A yellow smiling/content face on a yellow background. Happy emoji.
emoji,32706,gif,16,16,表情_IDM,ALL,https://images.heaton.com.cn/download/6889d8a2a8d753.77179851,library_16/emoji/32706.gif,cat-heart,A white cat with a heart on a pink background. Cute love motif.
emoji,32707,gif,16,16,表情_IDM,ALL,https://images.heaton.com.cn/download/6889d8a2a8d791.21294910,library_16/emoji/32707.gif,hamster,A tan hamster/mouse face on a dark background. Cute rodent.
emoji,32708,gif,16,16,表情_IDM,ALL,https://images.heaton.com.cn/download/6889d8a2a8d7d2.52574662,library_16/emoji/32708.gif,green-owl,A green owl/frog face on a dark background. Quirky creature.
emoji,32709,gif,16,16,表情_IDM,ALL,https://images.heaton.com.cn/download/6889d8a2a8d804.84201508,library_16/emoji/32709.gif,fox,An orange fox face on a brown background. Woodland animal.
emoji,32710,gif,16,16,表情_IDM,ALL,https://images.heaton.com.cn/download/6889d8a2a8d840.13445633,library_16/emoji/32710.gif,orange-fox,An orange fox/cat face on a pink background. Cute animal.
emoji,15891,gif,16,16,表情_IDM,ALL,https://images.heaton.com.cn/download/675bdcdf0679a6.89383540,library_16/emoji/15891.gif,pink-face,A pink face/pig with blue eyes on a pink background. Cute creature.
emoji,15892,gif,16,16,表情_IDM,ALL,https://images.heaton.com.cn/download/675bdcdf067a05.78875335,library_16/emoji/15892.gif,pink-emoji,A pink face/creature on a dark background. Cute emoji.
emoji,15893,gif,16,16,表情_IDM,ALL,https://images.heaton.com.cn/download/675bdcdf067a49.17081368,library_16/emoji/15893.gif,tan-smiley,A tan smiling face on a tan background. Happy emoji.
emoji,15894,gif,16,16,表情_IDM,ALL,https://images.heaton.com.cn/download/675bdcdf067a75.32622218,library_16/emoji/15894.gif,smiling-heart,A red heart with a grinning face on a dark background. Happy love emoji.
emoji,15895,gif,16,16,表情_IDM,ALL,https://images.heaton.com.cn/download/675bdcdf067ab3.67986964,library_16/emoji/15895.gif,orange-face,A round yellow/orange face on a dark background. Simple emoji.
emoji,15896,gif,16,16,表情_IDM,ALL,https://images.heaton.com.cn/download/675bdcdf067af6.46914673,library_16/emoji/15896.gif,happy-orange,An orange face with blushing cheeks on orange. Cheerful emoji.
emoji,15897,gif,16,16,表情_IDM,ALL,https://images.heaton.com.cn/download/675bdcdf067b27.92798607,library_16/emoji/15897.gif,number-one,A bold '1' on a red-and-black flag on blue. Number/first motif.
emoji,15898,gif,16,16,表情_IDM,ALL,https://images.heaton.com.cn/download/675bdcdf067b63.04373314,library_16/emoji/15898.gif,skull,A white skull on a dark background. Bony emoji.
emoji,15899,gif,16,16,表情_IDM,ALL,https://images.heaton.com.cn/download/675bdcdf067bc5.03981301,library_16/emoji/15899.gif,red-rose,A red rose flower on a dark background. Floral motif.
emoji,15900,gif,16,16,表情_IDM,ALL,https://images.heaton.com.cn/download/675bdcdf067c00.08034844,library_16/emoji/15900.gif,grinning-skull,A white skull grinning on a dark background. Spooky emoji.
emoji,15901,gif,16,16,表情_IDM,ALL,https://images.heaton.com.cn/download/675bdcdf067c39.27711758,library_16/emoji/15901.gif,crying-skull,A white skull with blue tears on an orange background. Sad-spooky emoji.
emoji,15902,gif,16,16,表情_IDM,ALL,https://images.heaton.com.cn/download/675bdcdf067c73.06240970,library_16/emoji/15902.gif,angry-red,A red face with bared teeth on a dark background. Angry emoji.
emoji,15903,gif,16,16,表情_IDM,ALL,https://images.heaton.com.cn/download/675bdcdf067cb6.54653703,library_16/emoji/15903.gif,skull-2,A pink-and-white skull on a red background. Spooky emoji.
emoji,15904,gif,16,16,表情_IDM,ALL,https://images.heaton.com.cn/download/675bdcdf067cf0.09334389,library_16/emoji/15904.gif,glitch-face,A red glitch-distorted face on a white background. Trippy emoji.
emoji,15905,gif,16,16,表情_IDM,ALL,https://images.heaton.com.cn/download/675bdcdf067d59.68973892,library_16/emoji/15905.gif,brown-smiley,A brown cookie-like smiling face on a dark background. Friendly emoji.
emoji,15906,gif,16,16,表情_IDM,ALL,https://images.heaton.com.cn/download/675bdcdf067d95.36726825,library_16/emoji/15906.gif,skull-3,A white skull on a dark background. Spooky emoji.
emoji,15907,gif,16,16,表情_IDM,ALL,https://images.heaton.com.cn/download/675bdcdf067dd2.45781030,library_16/emoji/15907.gif,white-face,A round white face/skull on a dark background. Pale emoji.
emoji,15908,gif,16,16,表情_IDM,ALL,https://images.heaton.com.cn/download/675bdcdf067e16.86560592,library_16/emoji/15908.gif,glitch-2,A blue-and-red glitch face/fish on a dark background. Distorted graphic.
emoji,15909,gif,16,16,表情_IDM,ALL,https://images.heaton.com.cn/download/675bdcdf067e52.57873644,library_16/emoji/15909.gif,green-face,A green face/blob with a grin on a dark background. Goofy emoji.
emoji,15910,gif,16,16,表情_IDM,ALL,https://images.heaton.com.cn/download/675bdcdf067e97.21891820,library_16/emoji/15910.gif,blue-smiley,A cyan-blue smiling face on a white background. Cheerful emoji.
emoji,15911,gif,16,16,表情_IDM,ALL,https://images.heaton.com.cn/download/675bdcdf067ee2.68997111,library_16/emoji/15911.gif,glitch-smiley,A red-and-blue 3D-glitch smiley on white. Trippy happy emoji.
emoji,15912,gif,16,16,表情_IDM,ALL,https://images.heaton.com.cn/download/675bdcdf067f66.20726182,library_16/emoji/15912.gif,chattering-teeth,A pink mouth showing chattering teeth on tan. Nervous/cold emoji.
emoji,15913,gif,16,16,表情_IDM,ALL,https://images.heaton.com.cn/download/675bdcdf067fc5.45106730,library_16/emoji/15913.gif,heart-outline,A pink-and-cyan heart outline on a dark background. Simple love icon.
emoji,15914,gif,16,16,表情_IDM,ALL,https://images.heaton.com.cn/download/675bdcdf068028.81645317,library_16/emoji/15914.gif,green-face-2,A green face with red eyes on a green background. Spooky emoji.
emoji,15915,gif,16,16,表情_IDM,ALL,https://images.heaton.com.cn/download/675bdcdf068066.21766248,library_16/emoji/15915.gif,gray-robot,A gray robot/machine box on a dark background. Mechanical emoji.
emoji,15916,gif,16,16,表情_IDM,ALL,https://images.heaton.com.cn/download/675bdcdf0680a8.82068275,library_16/emoji/15916.gif,red-heart,A red 3D heart on a white background. Love symbol.
emoji,15917,gif,16,16,表情_IDM,ALL,https://images.heaton.com.cn/download/675bdcdf0680e6.92802278,library_16/emoji/15917.gif,party-heart,A gold heart with confetti streamers on a dark background. Celebratory love.
emoji,15918,gif,16,16,表情_IDM,ALL,https://images.heaton.com.cn/download/675bdcdf068126.05284540,library_16/emoji/15918.gif,green-snake,A green snake/worm on a dark background. Slithery creature.
emoji,15919,gif,16,16,表情_IDM,ALL,https://images.heaton.com.cn/download/675bdcdf068194.68312795,library_16/emoji/15919.gif,pink-heart,A pink 3D heart on a pink background. Love icon.
emoji,15920,gif,16,16,表情_IDM,ALL,https://images.heaton.com.cn/download/675bdcdf0681d2.95384569,library_16/emoji/15920.gif,white-ghost,A white ghost on a dark background. Spooky spirit.
emoji,15921,gif,16,16,表情_IDM,ALL,https://images.heaton.com.cn/download/675bdcdf068217.62810022,library_16/emoji/15921.gif,red-v,A red heart/V shape on a dark background. Minimal love motif.
emoji,15922,gif,16,16,表情_IDM,ALL,https://images.heaton.com.cn/download/675bdcdf068255.62683860,library_16/emoji/15922.gif,red-box,A red square face/smiley on a dark background. Blocky emoji.
emoji,15923,gif,16,16,表情_IDM,ALL,https://images.heaton.com.cn/download/675bdcdf068293.73445718,library_16/emoji/15923.gif,dark-heart,A dark red heart with sparkles on a dark background. Moody love motif.
emoji,15924,gif,16,16,表情_IDM,ALL,https://images.heaton.com.cn/download/675bdcdf0682d6.92225687,library_16/emoji/15924.gif,green-grin,A green grinning face on a dark background. Goofy emoji.
emoji,15925,gif,16,16,表情_IDM,ALL,https://images.heaton.com.cn/download/675bdcdf068327.31578493,library_16/emoji/15925.gif,yellow-skull,A yellow skull on a dark background. Spooky emoji.
emoji,15926,gif,16,16,表情_IDM,ALL,https://images.heaton.com.cn/download/675bdcdf068387.37695503,library_16/emoji/15926.gif,lemon-face,A yellow lemon/face with little hands on a pink background. Citrus character.
emoji,15927,gif,16,16,表情_IDM,ALL,https://images.heaton.com.cn/download/675bdcdf0683e4.03037472,library_16/emoji/15927.gif,gray-ghost,A gray ghost/figure on a dark background. Simple spooky emoji.
emoji,15928,gif,16,16,表情_IDM,ALL,https://images.heaton.com.cn/download/675bdcdf068448.05476319,library_16/emoji/15928.gif,man-face,A man's face with gray hair and a blue shirt on dark. Person portrait.
emoji,15929,gif,16,16,表情_IDM,ALL,https://images.heaton.com.cn/download/675bdcdf0684a1.63218546,library_16/emoji/15929.gif,pig-face,A pink pig face on a dark background. Farm animal emoji.
emoji,15930,gif,16,16,表情_IDM,ALL,https://images.heaton.com.cn/download/675bdcdf068509.34125531,library_16/emoji/15930.gif,thumbs-up,A blue hand giving a thumbs up on white. Approval gesture.
emoji,15931,gif,16,16,表情_IDM,ALL,https://images.heaton.com.cn/download/675bdcdf068578.26527311,library_16/emoji/15931.gif,pink-bunny,"A pink bunny/cat character with a bow, like My Melody. Cute mascot."
emoji,15932,gif,16,16,表情_IDM,ALL,https://images.heaton.com.cn/download/675bdcdf0685f4.08465087,library_16/emoji/15932.gif,cap-character,A character in a green 'H' cap on an orange background. Costumed person.
emoji,15933,gif,16,16,表情_IDM,ALL,https://images.heaton.com.cn/download/675bdcdf068669.89002914,library_16/emoji/15933.gif,gray-mech,A gray robot/mech with red eyes on a dark background. Mechanical character.
emoji,15934,gif,16,16,表情_IDM,ALL,https://images.heaton.com.cn/download/675bdcdf0686b0.31726974,library_16/emoji/15934.gif,brown-bear,A brown bear/monkey in a Santa hat on white. Festive animal.
emoji,15935,gif,16,16,表情_IDM,ALL,https://images.heaton.com.cn/download/675bdcdf068710.58556419,library_16/emoji/15935.gif,white-ghost-2,A white ghost on a teal background. Spooky spirit.
emoji,15936,gif,16,16,表情_IDM,ALL,https://images.heaton.com.cn/download/675bdcdf068767.27783704,library_16/emoji/15936.gif,iron-man,A red-and-gold Iron Man helmet on a dark background. Superhero mask.
emoji,15937,gif,16,16,表情_IDM,ALL,https://images.heaton.com.cn/download/675bdcdf0687b1.01084300,library_16/emoji/15937.gif,steamed-bun,A white steamed bun/face on a dark background. Cute food emoji.
emoji,15938,gif,16,16,表情_IDM,ALL,https://images.heaton.com.cn/download/675bdcdf068834.32357368,library_16/emoji/15938.gif,white-smiley,A round white smiling face on a blue background. Happy emoji.
emoji,15939,gif,16,16,表情_IDM,ALL,https://images.heaton.com.cn/download/675bdcdf068887.50743331,library_16/emoji/15939.gif,red-mech,A red mech/faceplate with panels on a dark background. Mechanical motif.
emoji,15940,gif,16,16,表情_IDM,ALL,https://images.heaton.com.cn/download/675bdcdf0688d6.54127256,library_16/emoji/15940.gif,dark-heart,A dark red heart on a dark background. Moody love motif.
emoji,15941,gif,16,16,表情_IDM,ALL,https://images.heaton.com.cn/download/675bdcdf068913.97411530,library_16/emoji/15941.gif,pacman-maze,A yellow Pac-Man maze board on a dark background. Arcade motif.
emoji,15942,gif,16,16,表情_IDM,ALL,https://images.heaton.com.cn/download/675bdcdf068953.54721676,library_16/emoji/15942.gif,maroon-heart,A maroon heart on a dark background. Love icon.
emoji,15943,gif,16,16,表情_IDM,ALL,https://images.heaton.com.cn/download/675bdcdf068992.57405027,library_16/emoji/15943.gif,lazy-egg,A tired yellow egg-yolk face like Gudetama on orange. Sleepy emoji.
emoji,15944,gif,16,16,表情_IDM,ALL,https://images.heaton.com.cn/download/675bdcdf0689d2.58753250,library_16/emoji/15944.gif,red-heart-2,A red 3D heart on a blue background. Love symbol.
emoji,15945,gif,16,16,表情_IDM,ALL,https://images.heaton.com.cn/download/675bdcdf068a27.95807778,library_16/emoji/15945.gif,green-zigzag,A small green zigzag/snake on a dark background. Minimal creature.
emoji,15946,gif,16,16,表情_IDM,ALL,https://images.heaton.com.cn/download/675bdcdf068a65.88624155,library_16/emoji/15946.gif,rainbow-face,A smiling face inside a rainbow border on a dark background. Colorful emoji.
emoji,15947,gif,16,16,表情_IDM,ALL,https://images.heaton.com.cn/download/675bdcdf068aa7.21907520,library_16/emoji/15947.gif,red-heart-3,A red 3D heart on a dark background. Love symbol.
emoji,15948,gif,16,16,表情_IDM,ALL,https://images.heaton.com.cn/download/675bdcdf068ad4.98946073,library_16/emoji/15948.gif,brown-creature,A brown triangular creature with red eyes on purple. Quirky character.
emoji,15949,gif,16,16,表情_IDM,ALL,https://images.heaton.com.cn/download/675bdcdf068b98.85827496,library_16/emoji/15949.gif,purple-heart,A purple-maroon heart on a dark background. Love icon.
emoji,15950,gif,16,16,表情_IDM,ALL,https://images.heaton.com.cn/download/675bdcdf068bd4.45474827,library_16/emoji/15950.gif,pink-clown,A pink clown/troll face with goofy features on cyan. Funny emoji.
emoji,15951,gif,16,16,表情_IDM,ALL,https://images.heaton.com.cn/download/675bdcdf068c34.63432839,library_16/emoji/15951.gif,yellow-circle,A solid yellow circle/sun on a dark background. Minimal shape.
emoji,15952,gif,16,16,表情_IDM,ALL,https://images.heaton.com.cn/download/675bdcdf068c72.50760793,library_16/emoji/15952.gif,panda,A white-and-black panda face framed in a box on gray. Cute bear emoji.
emoji,15953,gif,16,16,表情_IDM,ALL,https://images.heaton.com.cn/download/675bdcdf068cb7.94597355,library_16/emoji/15953.gif,skull-ten,A white skull with the number '10' on an orange background. Spooky countdown.
emoji,15954,gif,16,16,表情_IDM,ALL,https://images.heaton.com.cn/download/675bdcdf068ce9.18739430,library_16/emoji/15954.gif,checker-glitch,A red-and-white checkered/glitch grid on a dark background. Abstract pattern.
emoji,15955,gif,16,16,表情_IDM,ALL,https://images.heaton.com.cn/download/675bdcdf068d25.80583599,library_16/emoji/15955.gif,helmet-smiley,A gray smiling face wearing a yellow helmet on dark. Worker emoji.
emoji,15956,gif,16,16,表情_IDM,ALL,https://images.heaton.com.cn/download/675bdcdf068d65.14138962,library_16/emoji/15956.gif,hanging-heart,A red heart hanging from a hook on a gray background. Hanging-love motif.
emoji,15957,gif,16,16,表情_IDM,ALL,https://images.heaton.com.cn/download/675bdcdf068da7.24338636,library_16/emoji/15957.gif,faint-heart,A faint dark-red heart on a dark background. Subtle love motif.
emoji,15958,gif,16,16,表情_IDM,ALL,https://images.heaton.com.cn/download/675bdcdf068e08.26215989,library_16/emoji/15958.gif,purple-zigzag,A small purple zigzag mark on a dark background. Minimal glyph.
emoji,15959,gif,16,16,表情_IDM,ALL,https://images.heaton.com.cn/download/675bdcdf068e69.50474932,library_16/emoji/15959.gif,red-box-smiley,A red square face with a smile on a dark background. Blocky emoji.
emoji,15960,gif,16,16,表情_IDM,ALL,https://images.heaton.com.cn/download/675bdcdf068ea9.99017280,library_16/emoji/15960.gif,blue-grin,A blue grinning mouth/face outline on a dark background. Cheeky emoji.
emoji,15961,gif,16,16,表情_IDM,ALL,https://images.heaton.com.cn/download/675bdcdf06a5d1.74668769,library_16/emoji/15961.gif,white-splash,A white paint splash/blob on a dark background. Messy graphic.
emoji,15962,gif,16,16,表情_IDM,ALL,https://images.heaton.com.cn/download/675bdcdf06a639.46286483,library_16/emoji/15962.gif,white-flower,A white flower with an orange center on green. Daisy motif.
emoji,15963,gif,16,16,表情_IDM,ALL,https://images.heaton.com.cn/download/675bdcdf06a672.33159461,library_16/emoji/15963.gif,white-red-eyes,A white face with glowing red eyes on a dark background. Eerie emoji.
emoji,15964,gif,16,16,表情_IDM,ALL,https://images.heaton.com.cn/download/675bdcdf06a6b2.66908336,library_16/emoji/15964.gif,pink-hair-girl,A pink-haired girl/clown face on a dark background. Character portrait.
emoji,15965,gif,16,16,表情_IDM,ALL,https://images.heaton.com.cn/download/675bdcdf06a757.50247467,library_16/emoji/15965.gif,teddy-heart,A brown teddy bear with a heart on a dark background. Affectionate plush.
emoji,15966,gif,16,16,表情_IDM,ALL,https://images.heaton.com.cn/download/675bdcdf06a790.29243071,library_16/emoji/15966.gif,pink-heart-2,A pink 3D heart on a dark background. Love icon.
emoji,15967,gif,16,16,表情_IDM,ALL,https://images.heaton.com.cn/download/675bdcdf06a7d3.22160901,library_16/emoji/15967.gif,gold-laugh,A golden laughing face on a dark background. Joyful emoji.
emoji,15968,gif,16,16,表情_IDM,ALL,https://images.heaton.com.cn/download/675bdcdf06a819.24163930,library_16/emoji/15968.gif,purple-mark,A small purple zigzag/mark on a dark background. Minimal glyph.
emoji,15969,gif,16,16,表情_IDM,ALL,https://images.heaton.com.cn/download/675bdcdf06a858.47182057,library_16/emoji/15969.gif,pink-grin,A pink face with a toothy grin on a dark background. Goofy emoji.
emoji,15970,gif,16,16,表情_IDM,ALL,https://images.heaton.com.cn/download/675bdcdf06a8a3.54195298,library_16/emoji/15970.gif,pink-monster,A pink-and-green creature with horns on a dark background. Quirky monster.
emoji,15971,gif,16,16,表情_IDM,ALL,https://images.heaton.com.cn/download/675bdcdf06a900.73768791,library_16/emoji/15971.gif,blue-screen,A blue screen/panel with a line. Minimal display motif.
emoji,15972,gif,16,16,表情_IDM,ALL,https://images.heaton.com.cn/download/675bdcdf06a966.19140688,library_16/emoji/15972.gif,gray-box,A gray boxy face/toaster on a tan background. Deadpan emoji.
emoji,15973,gif,16,16,表情_IDM,ALL,https://images.heaton.com.cn/download/675bdcdf06a9a7.90824645,library_16/emoji/15973.gif,lips-teeth,A red face with lips and a blue toothy mouth on dark. Expressive emoji.
emoji,15974,gif,16,16,表情_IDM,ALL,https://images.heaton.com.cn/download/675bdcdf06a9e1.35018991,library_16/emoji/15974.gif,pink-grin-2,A pink face with a toothy grin on a dark background. Goofy emoji.
emoji,15975,gif,16,16,表情_IDM,ALL,https://images.heaton.com.cn/download/675bdcdf06aa23.61060462,library_16/emoji/15975.gif,red-line-face,A red line-art face on a dark background. Minimal expression emoji.
emoji,15976,gif,16,16,表情_IDM,ALL,https://images.heaton.com.cn/download/675bdcdf06aa62.77382637,library_16/emoji/15976.gif,red-heart-4,A red 3D heart on a purple background. Love symbol.
emoji,15977,gif,16,16,表情_IDM,ALL,https://images.heaton.com.cn/download/675bdcdf06aab8.89237557,library_16/emoji/15977.gif,broken-heart,A red heart cracked down the middle on gray. Heartbreak emoji.
emoji,15978,gif,16,16,表情_IDM,ALL,https://images.heaton.com.cn/download/675bdcdf06ab04.53695117,library_16/emoji/15978.gif,red-robot,A red robot face with a gold tooth on a red background. Mechanical character.
emoji,15979,gif,16,16,表情_IDM,ALL,https://images.heaton.com.cn/download/675bdcdf06ab40.39432610,library_16/emoji/15979.gif,white-creature,A white creature/tooth on a teal background. Cute mascot.
emoji,15980,gif,16,16,表情_IDM,ALL,https://images.heaton.com.cn/download/675bdcdf06ab89.34081756,library_16/emoji/15980.gif,cupid-heart,A red heart with an arrow and wings on a dark background. Cupid's-arrow love.
emoji,15981,gif,16,16,表情_IDM,ALL,https://images.heaton.com.cn/download/675bdcdf06abc9.15982454,library_16/emoji/15981.gif,envelope,A white-and-pink envelope/love letter on pink. Message motif.
emoji,15982,gif,16,16,表情_IDM,ALL,https://images.heaton.com.cn/download/675bdcdf06ac07.36666368,library_16/emoji/15982.gif,silver-heart,A metallic silver heart/badge on a dark background. Shiny love emblem.
emoji,15983,gif,16,16,表情_IDM,ALL,https://images.heaton.com.cn/download/675bdcdf06ac49.33420510,library_16/emoji/15983.gif,melting-heart,A pink heart melting with a drip on a dark background. Sweet love motif.
emoji,15984,gif,16,16,表情_IDM,ALL,https://images.heaton.com.cn/download/675bdcdf06ac87.67682632,library_16/emoji/15984.gif,gray-grid,A gray grid with one green cell on a dark background. Pixel pattern.
emoji,15985,gif,16,16,表情_IDM,ALL,https://images.heaton.com.cn/download/675bdcdf06acc3.55974004,library_16/emoji/15985.gif,tiny-dot,A tiny white dot on a dark background. Minimal speck.
emoji,15986,gif,16,16,表情_IDM,ALL,https://images.heaton.com.cn/download/675bdcdf06ad03.22026737,library_16/emoji/15986.gif,cupid-heart-2,A red heart struck by an arrow on a purple background. Cupid's-arrow love.
emoji,15987,gif,16,16,表情_IDM,ALL,https://images.heaton.com.cn/download/675bdcdf06ad44.59245738,library_16/emoji/15987.gif,magenta-heart,A bright magenta 3D heart on a dark background. Vivid love icon.
emoji,15988,gif,16,16,表情_IDM,ALL,https://images.heaton.com.cn/download/675bdcdf06ad84.24499753,library_16/emoji/15988.gif,smiling-heart-2,A red heart with a grinning face on a dark background. Happy love emoji.
emoji,15989,gif,16,16,表情_IDM,ALL,https://images.heaton.com.cn/download/675bdcdf06adc5.01208298,library_16/emoji/15989.gif,robot-screen,A white robot with a colorful screen face on dark. Cute bot.
emoji,15990,gif,16,16,表情_IDM,ALL,https://images.heaton.com.cn/download/675bdcdf06ae08.74582600,library_16/emoji/15990.gif,rainbow-heart,A heart filled with rainbow stripes on a dark background. Colorful love icon.
emoji,15991,gif,16,16,表情_IDM,ALL,https://images.heaton.com.cn/download/675bdcdf06ae35.53084715,library_16/emoji/15991.gif,book,An open book/notebook on a tan background. Reading motif.
emoji,15992,gif,16,16,表情_IDM,ALL,https://images.heaton.com.cn/download/675bdcdf06ae79.11363589,library_16/emoji/15992.gif,heart-eyes,A yellow face with red heart eyes on yellow. 'In love' emoji.
emoji,15993,gif,16,16,表情_IDM,ALL,https://images.heaton.com.cn/download/675bdcdf06aeb5.98808785,library_16/emoji/15993.gif,rainbow-heart-2,A heart filled with rainbow stripes on a dark background. Colorful love icon.
emoji,15994,gif,16,16,表情_IDM,ALL,https://images.heaton.com.cn/download/675bdcdf06aee2.21972086,library_16/emoji/15994.gif,red-heart-5,A red 3D heart on a pink background. Love symbol.
emoji,15995,gif,16,16,表情_IDM,ALL,https://images.heaton.com.cn/download/675bdcdf06af23.49752298,library_16/emoji/15995.gif,red-heart-6,A glossy red heart on a white background. Love symbol.
emoji,15996,gif,16,16,表情_IDM,ALL,https://images.heaton.com.cn/download/675bdcdf06af62.34912909,library_16/emoji/15996.gif,pink-heart-checker,A pink heart on a green checkered background. Playful love motif.
emoji,15997,gif,16,16,表情_IDM,ALL,https://images.heaton.com.cn/download/675bdcdf06afa1.34357596,library_16/emoji/15997.gif,party-face,A yellow face wearing a party hat on dark. Celebration emoji.
emoji,15998,gif,16,16,表情_IDM,ALL,https://images.heaton.com.cn/download/675bdcdf06aff6.57911158,library_16/emoji/15998.gif,gold-laugh-2,A golden laughing face on a dark background. Joyful emoji.
emoji,15999,gif,16,16,表情_IDM,ALL,https://images.heaton.com.cn/download/675bdcdf06b029.84687685,library_16/emoji/15999.gif,magenta-heart-2,A magenta 3D heart on a cyan background. Vivid love icon.
emoji,16000,gif,16,16,表情_IDM,ALL,https://images.heaton.com.cn/download/675bdcdf06b064.65168451,library_16/emoji/16000.gif,cool-skull,A white skull wearing sunglasses on a pink background. Cool spooky emoji.
emoji,16001,gif,16,16,表情_IDM,ALL,https://images.heaton.com.cn/download/675bdcdf06b0a3.56827487,library_16/emoji/16001.gif,horned-smiley,A yellow smiley with little devil horns on a dark background. Mischievous emoji.
