category,file_id,format,width,height,category_name,label,file_path,local,name,description
emoji,16002,gif,16,16,表情_IDM,ALL,https://images.heaton.com.cn/download/675bdcdf06b0e3.16709110,library_16/emoji/16002.gif,pink-arms-up,A pink figure with arms raised on a pink background. Celebrating sprite.
emoji,16003,gif,16,16,表情_IDM,ALL,https://images.heaton.com.cn/download/675bdcdf06b122.81340096,library_16/emoji/16003.gif,red-heart-7,A red 3D heart on a white background. Love symbol.
emoji,16004,gif,16,16,表情_IDM,ALL,https://images.heaton.com.cn/download/675bdcdf06b164.85623034,library_16/emoji/16004.gif,pink-hearts,Several pink hearts on a pink background. Sweet love pattern.
emoji,16005,gif,16,16,表情_IDM,ALL,https://images.heaton.com.cn/download/675bdcdf06b192.15026663,library_16/emoji/16005.gif,robot-tv,A white robot/TV face on a pink striped background. Retro bot emoji.
emoji,16006,gif,16,16,表情_IDM,ALL,https://images.heaton.com.cn/download/675bdcdf06b1d0.65538038,library_16/emoji/16006.gif,color-grid,A grid of brightly colored squares on a dark background. Color palette.
emoji,16007,gif,16,16,表情_IDM,ALL,https://images.heaton.com.cn/download/675bdcdf06b211.92769692,library_16/emoji/16007.gif,magenta-heart-3,A magenta heart on a dark background. Vivid love icon.
emoji,16008,gif,16,16,表情_IDM,ALL,https://images.heaton.com.cn/download/675bdcdf06b240.46266400,library_16/emoji/16008.gif,rainbow-heart-3,A rainbow-colored heart on a dark background. Colorful love icon.
emoji,16009,gif,16,16,表情_IDM,ALL,https://images.heaton.com.cn/download/675bdcdf06b288.68554739,library_16/emoji/16009.gif,dotted-heart,A heart outline made of colorful dots on a dark background. Twinkling love icon.
emoji,16010,gif,16,16,表情_IDM,ALL,https://images.heaton.com.cn/download/675bdcdf06b2c2.86151401,library_16/emoji/16010.gif,claw-heart,A red heart held by a claw on a gray background. Claw-machine love motif.
emoji,16011,gif,16,16,表情_IDM,ALL,https://images.heaton.com.cn/download/675bdcdf06b2f4.49788485,library_16/emoji/16011.gif,thumbs-up-pink,A pink face with a white thumbs-up hand on pink. Like/approval emoji.
emoji,16012,gif,16,16,表情_IDM,ALL,https://images.heaton.com.cn/download/675bdcdf06b335.39685594,library_16/emoji/16012.gif,sparkle-heart,A red heart with a gold sparkle on a purple background. Shining love icon.
emoji,16013,gif,16,16,表情_IDM,ALL,https://images.heaton.com.cn/download/675bdcdf06b370.81167405,library_16/emoji/16013.gif,pig-face-2,A pink pig face on a pink background. Farm animal emoji.
emoji,16014,gif,16,16,表情_IDM,ALL,https://images.heaton.com.cn/download/675bdcdf06b3b0.52642552,library_16/emoji/16014.gif,red-heart-8,A red 3D heart on a dark background. Love symbol.
emoji,16015,gif,16,16,表情_IDM,ALL,https://images.heaton.com.cn/download/675bdcdf06b3e1.58649918,library_16/emoji/16015.gif,two-hearts,A pair of pink hearts on a dark background. Love-struck motif.
emoji,16016,gif,16,16,表情_IDM,ALL,https://images.heaton.com.cn/download/675bdcdf06b434.98911188,library_16/emoji/16016.gif,hearts-row,A row of three pink hearts on a dark background. Sweet love pattern.
emoji,16017,gif,16,16,表情_IDM,ALL,https://images.heaton.com.cn/download/675bdcdf06b473.95614164,library_16/emoji/16017.gif,horned-smiley-2,A yellow smiley with devil horns on a blue background. Mischievous emoji.
emoji,16018,gif,16,16,表情_IDM,ALL,https://images.heaton.com.cn/download/675bdcdf06b4b0.28098829,library_16/emoji/16018.gif,wood-heart,A brown wooden heart on a tan background. Rustic love icon.
emoji,16019,gif,16,16,表情_IDM,ALL,https://images.heaton.com.cn/download/675bdcdf06b4e8.87766262,library_16/emoji/16019.gif,glowing-heart,A glowing red heart with green leaves on a dark background. Vibrant love motif.
emoji,16020,gif,16,16,表情_IDM,ALL,https://images.heaton.com.cn/download/675bdcdf06b521.78068712,library_16/emoji/16020.gif,pink-heart-outline,A pink heart outline on a dark background. Simple love icon.
emoji,16021,gif,16,16,表情_IDM,ALL,https://images.heaton.com.cn/download/675bdcdf06b560.62131385,library_16/emoji/16021.gif,laughing-face,A yellow face laughing with a big smile on dark. Joyful emoji.
emoji,16022,gif,16,16,表情_IDM,ALL,https://images.heaton.com.cn/download/675bdcdf06b5a2.48536920,library_16/emoji/16022.gif,burning-heart,A dark heart with flames at its base on a dark background. Fiery passion motif.
emoji,16023,gif,16,16,表情_IDM,ALL,https://images.heaton.com.cn/download/675bdcdf06b5e8.78604290,library_16/emoji/16023.gif,gray-shape,A gray tooth/ghost-like shape on a gray background. Ambiguous form.
emoji,16024,gif,16,16,表情_IDM,ALL,https://images.heaton.com.cn/download/675bdcdf06b638.72032042,library_16/emoji/16024.gif,two-robots,Two gray robot/TV faces on a purple background. Pair of bots.
emoji,16025,gif,16,16,表情_IDM,ALL,https://images.heaton.com.cn/download/675bdcdf06b665.80077067,library_16/emoji/16025.gif,nested-heart,A pink heart nested in concentric frames on dark. Layered love icon.
emoji,16026,gif,16,16,表情_IDM,ALL,https://images.heaton.com.cn/download/675bdcdf06b6a5.02180848,library_16/emoji/16026.gif,purple-heart-2,A purple heart on a dark background. Love icon.
emoji,16027,gif,16,16,表情_IDM,ALL,https://images.heaton.com.cn/download/675bdcdf06b6e7.91624142,library_16/emoji/16027.gif,green-invader,A green Space-Invader alien on a green background. Retro arcade enemy.
emoji,16028,gif,16,16,表情_IDM,ALL,https://images.heaton.com.cn/download/675bdcdf06b721.11942047,library_16/emoji/16028.gif,magenta-heart-4,A magenta 3D heart on a dark background. Vivid love icon.
emoji,16029,gif,16,16,表情_IDM,ALL,https://images.heaton.com.cn/download/675bdcdf06b750.79100302,library_16/emoji/16029.gif,alert-heart,A red heart with an exclamation mark and green glitch. Warning/love-alert motif.
emoji,16030,gif,16,16,表情_IDM,ALL,https://images.heaton.com.cn/download/675bdcdf06b7a1.58017500,library_16/emoji/16030.gif,pink-heart-line,A pink heart crossed by a white line on a blue background. Stylized love icon.
emoji,16031,gif,16,16,表情_IDM,ALL,https://images.heaton.com.cn/download/675bdcdf06b7e0.83185964,library_16/emoji/16031.gif,red-heart-9,A glossy red heart on a purple background. Love symbol.
emoji,16032,gif,16,16,表情_IDM,ALL,https://images.heaton.com.cn/download/675bdcdf06b824.34589423,library_16/emoji/16032.gif,white-heart,A white-and-pink heart on a dark background. Soft love icon.
emoji,16033,gif,16,16,表情_IDM,ALL,https://images.heaton.com.cn/download/675bdcdf06b859.98682720,library_16/emoji/16033.gif,orange-block,An orange square with a white bar. Minimal color block.
emoji,16034,gif,16,16,表情_IDM,ALL,https://images.heaton.com.cn/download/675bdcdf06b892.61078213,library_16/emoji/16034.gif,glitch-skull,A white skull with red/blue glitch on a dark background. Spooky glitch emoji.
emoji,16035,gif,16,16,表情_IDM,ALL,https://images.heaton.com.cn/download/675bdcdf06b8d2.52127007,library_16/emoji/16035.gif,joy-face,A yellow face laughing with tears of joy on dark. Joyful emoji.
emoji,16036,gif,16,16,表情_IDM,ALL,https://images.heaton.com.cn/download/675bdcdf06b912.47788781,library_16/emoji/16036.gif,praying-hands,Two hands pressed together in prayer against a warm glow. Gratitude emoji.
emoji,16037,gif,16,16,表情_IDM,ALL,https://images.heaton.com.cn/download/675bdcdf06b954.96649435,library_16/emoji/16037.gif,storm-cloud,A white cloud with a lightning bolt on a dark background. Stormy weather motif.
emoji,16038,gif,16,16,表情_IDM,ALL,https://images.heaton.com.cn/download/675bdcdf06b984.30109772,library_16/emoji/16038.gif,white-smile,A white smiling-face outline on a dark background. Minimal happy emoji.
emoji,16039,gif,16,16,表情_IDM,ALL,https://images.heaton.com.cn/download/675bdcdf06b9c8.70519477,library_16/emoji/16039.gif,pink-screen,A pink box with a small TV/screen on a pink background. Retro device motif.
emoji,16040,gif,16,16,表情_IDM,ALL,https://images.heaton.com.cn/download/675bdcdf06ba07.89620857,library_16/emoji/16040.gif,pink-streaks,Pink streaks/dashes on a dark background. Abstract motion marks.
emoji,16041,gif,16,16,表情_IDM,ALL,https://images.heaton.com.cn/download/675bdcdf06ba45.07836690,library_16/emoji/16041.gif,dark-empty,"A mostly dark, near-empty scene. Blank frame."
emoji,16042,gif,16,16,表情_IDM,ALL,https://images.heaton.com.cn/download/675bdcdf06ba81.88063547,library_16/emoji/16042.gif,tiny-pixels,A few tiny red and blue pixels on a dark background. Minimal speckle.
emoji,16043,gif,16,16,表情_IDM,ALL,https://images.heaton.com.cn/download/675bdcdf06bab9.12138292,library_16/emoji/16043.gif,red-devil,A red horned devil/demon face on a dark background. Mischievous emoji.
emoji,16044,gif,16,16,表情_IDM,ALL,https://images.heaton.com.cn/download/675bdcdf06bb09.35436719,library_16/emoji/16044.gif,thumbs-up-heart,A hand giving a thumbs up with a red heart on blue. Like-and-love motif.
emoji,16045,gif,16,16,表情_IDM,ALL,https://images.heaton.com.cn/download/675bdcdf06bb40.62296429,library_16/emoji/16045.gif,sad-cream-face,"A cream face with a tear, looking sad. Crying emoji."
emoji,16046,gif,16,16,表情_IDM,ALL,https://images.heaton.com.cn/download/675bdcdf06bb88.40056666,library_16/emoji/16046.gif,cream-face,A cream face with a neutral expression. Plain emoji.
emoji,16047,gif,16,16,表情_IDM,ALL,https://images.heaton.com.cn/download/675bdcdf06bbc8.51011944,library_16/emoji/16047.gif,sleepy-cream-face,A cream face with a sleepy/winking expression. Drowsy emoji.
emoji,16048,gif,16,16,表情_IDM,ALL,https://images.heaton.com.cn/download/675bdcdf06bc04.57181717,library_16/emoji/16048.gif,coffee-cream-face,A sleepy cream face with a coffee cup. Need-caffeine emoji.
emoji,16049,gif,16,16,表情_IDM,ALL,https://images.heaton.com.cn/download/675bdcdf06bc31.38439176,library_16/emoji/16049.gif,tired-cream-face,"A cream face with tired, droopy eyes. Exhausted emoji."
emoji,16050,gif,16,16,表情_IDM,ALL,https://images.heaton.com.cn/download/675bdcdf06bc74.96685857,library_16/emoji/16050.gif,blush-cream-face,A cream face with blushing cheeks. Bashful emoji.
emoji,16051,gif,16,16,表情_IDM,ALL,https://images.heaton.com.cn/download/675bdcdf06bcb0.64499698,library_16/emoji/16051.gif,crying-cream-face,A cream face with streaming tears. Sad/crying emoji.
emoji,16052,gif,16,16,表情_IDM,ALL,https://images.heaton.com.cn/download/675bdcdf06bcf3.24419241,library_16/emoji/16052.gif,sleepy-cream-face-2,"A cream face with closed, sleepy eyes. Drowsy emoji."
emoji,16053,gif,16,16,表情_IDM,ALL,https://images.heaton.com.cn/download/675bdcdf06bd27.25011042,library_16/emoji/16053.gif,cream-face-2,A cream face with a neutral expression on a dark background. Plain emoji.
creative,32711,gif,16,16,创意_IDM,ALL,https://images.heaton.com.cn/download/6889d9ab33a995.29471683,library_16/creative/32711.gif,flying-bird,A gray bird/plane on a blue cloudy background. Aerial scene.
creative,32712,gif,16,16,创意_IDM,ALL,https://images.heaton.com.cn/download/6889d9ab33aaa9.23205045,library_16/creative/32712.gif,clown,A red-haired clown on a dark background. Circus character.
creative,32713,gif,16,16,创意_IDM,ALL,https://images.heaton.com.cn/download/6889d9ab33ab09.32687952,library_16/creative/32713.gif,conveyor,An industrial conveyor/machine scene with a flame. Factory motif.
creative,32714,gif,16,16,创意_IDM,ALL,https://images.heaton.com.cn/download/6889d9ab33ab55.70427209,library_16/creative/32714.gif,green-creature,A green frog/sandwich-like creature on a white background. Quirky character.
creative,32715,gif,16,16,创意_IDM,ALL,https://images.heaton.com.cn/download/6889d9ab33ab97.24990146,library_16/creative/32715.gif,banana-split,A banana split/dessert in a dish on a green background. Sweet treat.
creative,32716,gif,16,16,创意_IDM,ALL,https://images.heaton.com.cn/download/6889d9ab33abe3.61363363,library_16/creative/32716.gif,brown-figure,A brown-and-blue robot/figure on a white background. Character motif.
creative,32717,gif,16,16,创意_IDM,ALL,https://images.heaton.com.cn/download/6889d9ab33ac33.09275081,library_16/creative/32717.gif,thumbs-up,A pink hand giving a thumbs up on a dark background. Approval gesture.
creative,16054,gif,16,16,创意_IDM,ALL,https://images.heaton.com.cn/download/675bdcdf06bd68.18970727,library_16/creative/16054.gif,fried-egg,A fried egg on a dark background. Breakfast food.
creative,16055,gif,16,16,创意_IDM,ALL,https://images.heaton.com.cn/download/675bdcdf06bda2.69536124,library_16/creative/16055.gif,red-heart,A red 3D heart on a dark background. Love symbol.
creative,16056,gif,16,16,创意_IDM,ALL,https://images.heaton.com.cn/download/675bdcdf06bde0.68921416,library_16/creative/16056.gif,gray-door,A gray door/locker on a gray background. Doorway motif.
creative,16057,gif,16,16,创意_IDM,ALL,https://images.heaton.com.cn/download/675bdcdf06be26.39326151,library_16/creative/16057.gif,frog,A green frog face on a dark background. Amphibian.
creative,16058,gif,16,16,创意_IDM,ALL,https://images.heaton.com.cn/download/675bdcdf06be51.70142285,library_16/creative/16058.gif,green-bushes,Green hills/bushes on a white background. Foliage motif.
creative,16059,gif,16,16,创意_IDM,ALL,https://images.heaton.com.cn/download/675bdcdf06be97.49604117,library_16/creative/16059.gif,bomb,A round gray bomb on a dark background. Explosive icon.
creative,16060,gif,16,16,创意_IDM,ALL,https://images.heaton.com.cn/download/675bdcdf06bec8.03266534,library_16/creative/16060.gif,dark-monster,A black creature with red eyes on a dark background. Shadowy monster.
creative,16061,gif,16,16,创意_IDM,ALL,https://images.heaton.com.cn/download/675bdcdf06bf09.75022912,library_16/creative/16061.gif,earth,The planet Earth as a blue-and-green globe. Our world icon.
creative,16062,gif,16,16,创意_IDM,ALL,https://images.heaton.com.cn/download/675bdcdf06bf38.00645790,library_16/creative/16062.gif,gold-coin,A round gold coin/cookie on a dark background. Money/treasure icon.
creative,16063,gif,16,16,创意_IDM,ALL,https://images.heaton.com.cn/download/675bdcdf06bf70.17885318,library_16/creative/16063.gif,nerd-face,A yellow face with glasses and big teeth on yellow. Nerdy/goofy emoji.
creative,16064,gif,16,16,创意_IDM,ALL,https://images.heaton.com.cn/download/675bdcdf06bfb6.11157940,library_16/creative/16064.gif,pumpkin,A jack-o'-lantern pumpkin on a dark background. Halloween icon.
creative,16065,gif,16,16,创意_IDM,ALL,https://images.heaton.com.cn/download/675bdcdf06bff8.50031541,library_16/creative/16065.gif,pink-scene,A pink room/scene with a plant/creature. Cozy interior vignette.
creative,16066,gif,16,16,创意_IDM,ALL,https://images.heaton.com.cn/download/675bdcdf06c031.59695910,library_16/creative/16066.gif,blue-skull,A glowing blue skull/mask on a dark background. Spooky neon motif.
creative,16067,gif,16,16,创意_IDM,ALL,https://images.heaton.com.cn/download/675bdcdf06c071.69651939,library_16/creative/16067.gif,framed-art,A framed bird/trophy picture on a white background. Gallery art.
creative,16068,gif,16,16,创意_IDM,ALL,https://images.heaton.com.cn/download/675bdcdf06c0a4.45556626,library_16/creative/16068.gif,red-square,A red square on a gray background. Minimal color block.
creative,16069,gif,16,16,创意_IDM,ALL,https://images.heaton.com.cn/download/675bdcdf06c0e1.08123118,library_16/creative/16069.gif,brown-owl,A brown owl/bear with flowers on a dark background. Woodland animal.
creative,16070,gif,16,16,创意_IDM,ALL,https://images.heaton.com.cn/download/675bdcdf06c125.49683626,library_16/creative/16070.gif,white-bunny,A white rabbit on a cream background. Cute bunny.
creative,16071,gif,16,16,创意_IDM,ALL,https://images.heaton.com.cn/download/675bdcdf06c165.72996140,library_16/creative/16071.gif,among-us,A red Among Us crewmate on a white background. Game mascot.
creative,16072,gif,16,16,创意_IDM,ALL,https://images.heaton.com.cn/download/675bdcdf06c1b2.15068975,library_16/creative/16072.gif,mint-robot,A mint-green robot face on a dark background. Friendly bot.
creative,16073,gif,16,16,创意_IDM,ALL,https://images.heaton.com.cn/download/675bdcdf06c1e9.10217492,library_16/creative/16073.gif,duck-leaf,A white duck/bird with a leaf on a green background. Cute bird scene.
creative,16074,gif,16,16,创意_IDM,ALL,https://images.heaton.com.cn/download/675bdcdf06c220.98328589,library_16/creative/16074.gif,yellow-skull,A yellow skull on a dark background. Spooky emoji.
creative,16075,gif,16,16,创意_IDM,ALL,https://images.heaton.com.cn/download/675bdcdf06c269.45929043,library_16/creative/16075.gif,teddy-bear,A brown teddy bear on a dark background. Cuddly toy.
creative,16076,gif,16,16,创意_IDM,ALL,https://images.heaton.com.cn/download/675bdcdf06c2a7.97705948,library_16/creative/16076.gif,monkey-face,A brown monkey/creature face on a dark background. Primate portrait.
creative,16077,gif,16,16,创意_IDM,ALL,https://images.heaton.com.cn/download/675bdcdf06c2e1.25761638,library_16/creative/16077.gif,glasses-man,A man's face with glasses on a brown background. Bespectacled portrait.
creative,16078,gif,16,16,创意_IDM,ALL,https://images.heaton.com.cn/download/675bdcdf06c320.55969305,library_16/creative/16078.gif,dotted-board,A dark board scattered with colored dots. Game/radar grid.
creative,16079,gif,16,16,创意_IDM,ALL,https://images.heaton.com.cn/download/675bdcdf06c365.64703487,library_16/creative/16079.gif,rainbow-glitch,A glitchy pattern of rainbow stripes on a dark background. Digital distortion.
creative,16080,gif,16,16,创意_IDM,ALL,https://images.heaton.com.cn/download/675bdcdf06c3a2.12785177,library_16/creative/16080.gif,rainbow-kaleidoscope,Concentric rainbow diamonds forming a kaleidoscope. Psychedelic design.
creative,16081,gif,16,16,创意_IDM,ALL,https://images.heaton.com.cn/download/675bdcdf06c3e4.25476494,library_16/creative/16081.gif,blue-target,Concentric blue circles forming a target on dark. Bullseye pattern.
creative,16082,gif,16,16,创意_IDM,ALL,https://images.heaton.com.cn/download/675bdcdf06c418.21826675,library_16/creative/16082.gif,blue-glyphs,Blue tech symbols/glyphs on a dark background. Neon glyph motif.
creative,16083,gif,16,16,创意_IDM,ALL,https://images.heaton.com.cn/download/675bdcdf06c456.78670041,library_16/creative/16083.gif,blue-diamond,A glowing blue diamond/crystal on a dark background. Gem motif.
creative,16084,gif,16,16,创意_IDM,ALL,https://images.heaton.com.cn/download/675bdcdf06c490.14377508,library_16/creative/16084.gif,rainbow-quilt,A colorful rainbow checker/quilt pattern on dark. Mosaic design.
creative,16085,gif,16,16,创意_IDM,ALL,https://images.heaton.com.cn/download/675bdcdf06c4e8.39961165,library_16/creative/16085.gif,green-diamond,A green diamond/abstract scene on a dark background. Geometric motif.
creative,16086,gif,16,16,创意_IDM,ALL,https://images.heaton.com.cn/download/675bdcdf06c524.10837606,library_16/creative/16086.gif,red-cross-grid,A red checkered grid forming a cross on green. Geometric pattern.
creative,16087,gif,16,16,创意_IDM,ALL,https://images.heaton.com.cn/download/675bdcdf06c551.55150910,library_16/creative/16087.gif,red-tunnel,Concentric red circles forming a tunnel/target. Hypnotic pattern.
creative,16088,gif,16,16,创意_IDM,ALL,https://images.heaton.com.cn/download/675bdcdf06c598.82325212,library_16/creative/16088.gif,blue-tunnel,Concentric blue squares forming a tunnel effect. Geometric depth illusion.
creative,16089,gif,16,16,创意_IDM,ALL,https://images.heaton.com.cn/download/675bdcdf06c5d2.98327203,library_16/creative/16089.gif,green-rings,Concentric green circles/rings. Radial target pattern.
creative,16090,gif,16,16,创意_IDM,ALL,https://images.heaton.com.cn/download/675bdcdf06c618.52257065,library_16/creative/16090.gif,pink-hourglass,A pink hourglass/bowtie shape on a dark background. Symmetry motif.
creative,16091,gif,16,16,创意_IDM,ALL,https://images.heaton.com.cn/download/675bdcdf06c652.54145229,library_16/creative/16091.gif,blue-grid,A grid of small blue squares on a dark background. Minimal dot grid.
creative,16092,gif,16,16,创意_IDM,ALL,https://images.heaton.com.cn/download/675bdcdf06c692.55695530,library_16/creative/16092.gif,cyan-red-creature,A two-tone cyan-and-red robot/alien on a dark background. Quirky character.
creative,16093,gif,16,16,创意_IDM,ALL,https://images.heaton.com.cn/download/675bdcdf06c6e1.50079090,library_16/creative/16093.gif,stop-hand,"A white hand on a red circle, the universal 'stop' sign."
creative,16094,gif,16,16,创意_IDM,ALL,https://images.heaton.com.cn/download/675bdcdf06c717.84683088,library_16/creative/16094.gif,color-cross,A dark scene with a colorful cross/diamond element. Game pickup motif.
creative,16095,gif,16,16,创意_IDM,ALL,https://images.heaton.com.cn/download/675bdcdf06c750.62913933,library_16/creative/16095.gif,fire-pattern,A repeating pattern of flames/explosions on dark. Fiery texture.
creative,16096,gif,16,16,创意_IDM,ALL,https://images.heaton.com.cn/download/675bdcdf06c798.53330125,library_16/creative/16096.gif,open-sign,Glowing red neon 'OPEN' text on a dark background. Shop signage.
creative,16097,gif,16,16,创意_IDM,ALL,https://images.heaton.com.cn/download/675bdcdf06c7e6.73941550,library_16/creative/16097.gif,letter-m,A bold 'M' on a yellow/green background. Letter/logo motif.
creative,16098,gif,16,16,创意_IDM,ALL,https://images.heaton.com.cn/download/675bdcdf06c821.14728453,library_16/creative/16098.gif,giraffe,A yellow giraffe/creature on a dark background. Long-necked animal.
creative,16099,gif,16,16,创意_IDM,ALL,https://images.heaton.com.cn/download/675bdcdf06c862.21589395,library_16/creative/16099.gif,ocean,A blue ocean/water scene on a dark background. Seascape.
creative,16100,gif,16,16,创意_IDM,ALL,https://images.heaton.com.cn/download/675bdcdf06c8a4.24299440,library_16/creative/16100.gif,running-girl,A blonde girl/princess running on a dark background. Action sprite.
creative,16101,gif,16,16,创意_IDM,ALL,https://images.heaton.com.cn/download/675bdcdf06c8e8.48274391,library_16/creative/16101.gif,green-invader,A green Space-Invader alien on a dark background. Retro arcade enemy.
creative,16102,gif,16,16,创意_IDM,ALL,https://images.heaton.com.cn/download/675bdcdf06c914.99445619,library_16/creative/16102.gif,spaceship,A gray-and-red spaceship on a dark background. Sci-fi craft.
creative,16103,gif,16,16,创意_IDM,ALL,https://images.heaton.com.cn/download/675bdcdf06c953.51513613,library_16/creative/16103.gif,green-octopus,A green octopus/squid with tentacles on a dark background. Sea monster.
creative,16104,gif,16,16,创意_IDM,ALL,https://images.heaton.com.cn/download/675bdcdf06ca30.81635068,library_16/creative/16104.gif,green-turtle,A green turtle/frog creature on a teal background. Friendly reptile.
creative,16105,gif,16,16,创意_IDM,ALL,https://images.heaton.com.cn/download/675bdcdf06ca80.74743103,library_16/creative/16105.gif,red-flag,A red flag/object on a white background. Flag motif.
creative,16106,gif,16,16,创意_IDM,ALL,https://images.heaton.com.cn/download/675bdcdf06cac5.33612981,library_16/creative/16106.gif,empty,An empty black panel with no visible subject. Blank frame.
creative,16107,gif,16,16,创意_IDM,ALL,https://images.heaton.com.cn/download/675bdcdf06cb00.02399135,library_16/creative/16107.gif,empty-2,An empty black panel with no visible subject. Blank frame.
creative,16108,gif,16,16,创意_IDM,ALL,https://images.heaton.com.cn/download/675bdcdf06cb45.72066149,library_16/creative/16108.gif,green-monster,A green monster/frog creature on a green background. Goofy critter.
creative,16109,gif,16,16,创意_IDM,ALL,https://images.heaton.com.cn/download/675bdcdf06cb81.18207950,library_16/creative/16109.gif,book-shelf,A red-and-white book on a shelf on a dark background. Library motif.
creative,16110,gif,16,16,创意_IDM,ALL,https://images.heaton.com.cn/download/675bdcdf06cbc1.49508497,library_16/creative/16110.gif,gold-scene,A golden treasure/hazard scene on a dark background. Shiny motif.
creative,16111,gif,16,16,创意_IDM,ALL,https://images.heaton.com.cn/download/675bdcdf06cc06.89373292,library_16/creative/16111.gif,cyan-machine,A robot/machine on a bright cyan background. Mechanical scene.
creative,16112,gif,16,16,创意_IDM,ALL,https://images.heaton.com.cn/download/675bdcdf06cc47.55510171,library_16/creative/16112.gif,gray-bot,A gray robot face with an orange mouth on dark. Mechanical character.
creative,16113,gif,16,16,创意_IDM,ALL,https://images.heaton.com.cn/download/675bdcdf06cc77.10412196,library_16/creative/16113.gif,purple-gems,Purple-and-red gems/blocks on a dark background. Treasure motif.
creative,16114,gif,16,16,创意_IDM,ALL,https://images.heaton.com.cn/download/675bdcdf06ccb9.24166531,library_16/creative/16114.gif,forest-figure,A figure standing in a forest on a dark background. Outdoor scene.
creative,16115,gif,16,16,创意_IDM,ALL,https://images.heaton.com.cn/download/675bdcdf06ccf5.73743859,library_16/creative/16115.gif,blue-ghost,A blue Pac-Man ghost on a dark background. Arcade enemy.
creative,16116,gif,16,16,创意_IDM,ALL,https://images.heaton.com.cn/download/675bdcdf06cd31.32969195,library_16/creative/16116.gif,sword,A gray sword/blade on a dark background. Weapon icon.
creative,16117,gif,16,16,创意_IDM,ALL,https://images.heaton.com.cn/download/675bdcdf06cd80.87129569,library_16/creative/16117.gif,character-scene,A character/figure in a small scene on blue. Sprite vignette.
creative,16118,gif,16,16,创意_IDM,ALL,https://images.heaton.com.cn/download/675bdcdf06cdb5.73043664,library_16/creative/16118.gif,gray-bars,"Vertical gray-and-white bars, like a curtain/barcode. Striped pattern."
