category,file_id,format,width,height,category_name,label,file_path,local,name,description
holiday,17599,png,32,32,节日_IDM,ALL,https://images.heaton.com.cn/download/675bdcdf0b3720.86551647,library_images/holiday/17599.png,blue-joker,A blue-green Joker/zombie face. Creepy Halloween portrait.
holiday,17600,png,32,32,节日_IDM,ALL,https://images.heaton.com.cn/download/675bdcdf0b3767.89521357,library_images/holiday/17600.png,white-robot,A white robot/doctor figure. Mechanical character.
holiday,17601,png,32,32,节日_IDM,ALL,https://images.heaton.com.cn/download/675bdcdf0b37a5.00916713,library_images/holiday/17601.png,fu-fortune,The red Chinese character 福 ('fortune') on red. Lunar New Year motif.
holiday,17602,png,32,32,节日_IDM,ALL,https://images.heaton.com.cn/download/675bdcdf0b37e2.10925703,library_images/holiday/17602.png,pink-heart-6,A pink 3D heart with sparkles. Sweet love icon.
holiday,17603,png,32,32,节日_IDM,ALL,https://images.heaton.com.cn/download/675bdcdf0b3816.86096441,library_images/holiday/17603.png,pink-gift-2,A pink gift/screen box. Present motif.
holiday,17604,png,32,32,节日_IDM,ALL,https://images.heaton.com.cn/download/675bdcdf0b3949.67475725,library_images/holiday/17604.png,green-creature-3,A green frog/monster creature on a dark background. Goofy critter.
holiday,17605,png,32,32,节日_IDM,ALL,https://images.heaton.com.cn/download/675bdcdf0b39a1.58540562,library_images/holiday/17605.png,sunset-heart,A heart containing a sunset scene. Romantic love-and-sky motif.
holiday,17606,png,32,32,节日_IDM,ALL,https://images.heaton.com.cn/download/675bdcdf0b39f4.01268095,library_images/holiday/17606.png,purple-bat,A purple/pink bat creature on a pink background. Halloween animal.
holiday,17607,png,32,32,节日_IDM,ALL,https://images.heaton.com.cn/download/675bdcdf0b3a49.38858067,library_images/holiday/17607.png,purple-heart-4,A purple-pink 3D heart on a purple background. Love icon.
holiday,17608,png,32,32,节日_IDM,ALL,https://images.heaton.com.cn/download/675bdcdf0b3aa2.02857699,library_images/holiday/17608.png,beaded-heart,A heart outline made of colorful beads/lights. Festive love decoration.
holiday,17609,png,32,32,节日_IDM,ALL,https://images.heaton.com.cn/download/675bdcdf0b3af3.61422339,library_images/holiday/17609.png,doctor-face,A man's face in a doctor's coat. Person/professional portrait.
holiday,17610,png,32,32,节日_IDM,ALL,https://images.heaton.com.cn/download/675bdcdf0b3b71.77466312,library_images/holiday/17610.png,teddy-bear-2,A brown teddy bear with a heart. Affectionate plush toy.
holiday,17611,png,32,32,节日_IDM,ALL,https://images.heaton.com.cn/download/675bdcdf0b3bc5.41713362,library_images/holiday/17611.png,pink-camera,A pink retro camera on a pink background. Photography icon.
holiday,17612,png,32,32,节日_IDM,ALL,https://images.heaton.com.cn/download/675bdcdf0b3c23.01565896,library_images/holiday/17612.png,red-heart-9,A red 3D heart on a blue background. Love symbol.
holiday,17613,png,32,32,节日_IDM,ALL,https://images.heaton.com.cn/download/675bdcdf0b3c75.34915769,library_images/holiday/17613.png,ghost-hearts-2,A white ghost surrounded by little red hearts. Spooky-cute love motif.
holiday,17614,png,32,32,节日_IDM,ALL,https://images.heaton.com.cn/download/675bdcdf0b3cc1.09442157,library_images/holiday/17614.png,green-orange-hearts,A green heart and an orange heart on purple. Pair of love hearts.
holiday,17615,png,32,32,节日_IDM,ALL,https://images.heaton.com.cn/download/675bdcdf0b3d02.58904914,library_images/holiday/17615.png,cupcake-2,A cupcake with pink frosting. Sweet baked treat.
holiday,17616,png,32,32,节日_IDM,ALL,https://images.heaton.com.cn/download/675bdcdf0b3d38.33248698,library_images/holiday/17616.png,love-letter,A white envelope/love letter with a little face. Romantic message motif.
holiday,17617,png,32,32,节日_IDM,ALL,https://images.heaton.com.cn/download/675bdcdf0b3d91.32269993,library_images/holiday/17617.png,couple-2,A man and woman couple on a red background. Romance scene.
holiday,17618,png,32,32,节日_IDM,ALL,https://images.heaton.com.cn/download/675bdcdf0b3de1.66123405,library_images/holiday/17618.png,gray-bunny,A gray rabbit on a pink background. Cute bunny portrait.
holiday,17619,png,32,32,节日_IDM,ALL,https://images.heaton.com.cn/download/675bdcdf0b3e24.86448138,library_images/holiday/17619.png,green-heart,A green 3D heart on a black background. Love icon.
holiday,17620,png,32,32,节日_IDM,ALL,https://images.heaton.com.cn/download/675bdcdf0b3e51.93467821,library_images/holiday/17620.png,heart-figure,A red heart with a small figure on a blue background. Love-themed scene.
holiday,17621,png,32,32,节日_IDM,ALL,https://images.heaton.com.cn/download/675bdcdf0b3e96.82208020,library_images/holiday/17621.png,pink-pig-2,A pink pig on a magenta background. Cute farm animal.
holiday,17622,png,32,32,节日_IDM,ALL,https://images.heaton.com.cn/download/675bdcdf0b3ed2.98986046,library_images/holiday/17622.png,red-nested-square,A red square nested in concentric frames on magenta. Geometric tunnel pattern.
holiday,17623,png,32,32,节日_IDM,ALL,https://images.heaton.com.cn/download/675bdcdf0b3f31.03637742,library_images/holiday/17623.png,pumpkin,An orange pumpkin on a dark background. Autumn/Halloween icon.
holiday,17624,png,32,32,节日_IDM,ALL,https://images.heaton.com.cn/download/675bdcdf0b3f79.18437092,library_images/holiday/17624.png,red-heart-10,A red 3D heart on a blue background. Love symbol.
holiday,17625,png,32,32,节日_IDM,ALL,https://images.heaton.com.cn/download/675bdcdf0b3fb7.82583450,library_images/holiday/17625.png,xmas-tree-6,A fully decorated Christmas tree with lights and ornaments. Festive centerpiece.
holiday,17626,png,32,32,节日_IDM,ALL,https://images.heaton.com.cn/download/675bdcdf0b3ff1.34241739,library_images/holiday/17626.png,snowy-night,A snowy night scene with a small tree. Quiet winter vignette.
holiday,17627,png,32,32,节日_IDM,ALL,https://images.heaton.com.cn/download/675bdcdf0b4037.02919664,library_images/holiday/17627.png,red-heart-cream,A red heart on a cream background. Love icon.
holiday,17628,png,32,32,节日_IDM,ALL,https://images.heaton.com.cn/download/675bdcdf0b4075.20787875,library_images/holiday/17628.png,wreath-2,A green Christmas wreath with a bell and bow. Holiday door decoration.
holiday,17629,png,32,32,节日_IDM,ALL,https://images.heaton.com.cn/download/675bdcdf0b40a2.37115534,library_images/holiday/17629.png,yellow-gift-2,A yellow-and-red wrapped present with a bow. Gift motif.
holiday,17630,png,32,32,节日_IDM,ALL,https://images.heaton.com.cn/download/675bdcdf0b4109.66734211,library_images/holiday/17630.png,xmas-tree-7,A decorated green Christmas tree. Festive evergreen.
holiday,17631,png,32,32,节日_IDM,ALL,https://images.heaton.com.cn/download/675bdcdf0b4141.09218070,library_images/holiday/17631.png,snowman-2,A white snowman with a hat on a cyan background. Winter character.
holiday,17632,png,32,32,节日_IDM,ALL,https://images.heaton.com.cn/download/675bdcdf0b4181.28307800,library_images/holiday/17632.png,santa-hat-person,A person wearing a Santa hat on a pink background. Festive portrait.
holiday,17633,png,32,32,节日_IDM,ALL,https://images.heaton.com.cn/download/675bdcdf0b41c0.35243888,library_images/holiday/17633.png,red-heart-11,A glossy red 3D heart on black. Love symbol.
holiday,17634,png,32,32,节日_IDM,ALL,https://images.heaton.com.cn/download/675bdcdf0b41f4.11319256,library_images/holiday/17634.png,skull-5,A white skull/skeleton face on a dark background. Spooky motif.
holiday,17635,png,32,32,节日_IDM,ALL,https://images.heaton.com.cn/download/675bdcdf0b4239.81778946,library_images/holiday/17635.png,santa-7,A Santa Claus figure on a blue starry background. Christmas character.
holiday,17636,png,32,32,节日_IDM,ALL,https://images.heaton.com.cn/download/675bdcdf0b4277.01194478,library_images/holiday/17636.png,house,A brown house with a red roof on a red background. Home icon.
holiday,17637,png,32,32,节日_IDM,ALL,https://images.heaton.com.cn/download/675bdcdf0b42d9.93248252,library_images/holiday/17637.png,gold-bell,A gold Christmas bell with a red bow. Festive chime.
holiday,17638,png,32,32,节日_IDM,ALL,https://images.heaton.com.cn/download/675bdcdf0b4313.50597963,library_images/holiday/17638.png,santa-8,A red-suited Santa Claus on a green background. Holiday mascot.
holiday,17639,png,32,32,节日_IDM,ALL,https://images.heaton.com.cn/download/675bdcdf0b4354.09409377,library_images/holiday/17639.png,cat-santa,A gray cat/wolf wearing a Santa hat. Festive pet.
holiday,17640,png,32,32,节日_IDM,ALL,https://images.heaton.com.cn/download/675bdcdf0b4393.86937760,library_images/holiday/17640.png,santa-boy,A boy in a Santa outfit with an excited expression. Christmas kid.
holiday,17641,png,32,32,节日_IDM,ALL,https://images.heaton.com.cn/download/675bdcdf0b43d9.53095460,library_images/holiday/17641.png,santa-girl,A girl in a Santa hat. Festive winter portrait.
holiday,17642,png,32,32,节日_IDM,ALL,https://images.heaton.com.cn/download/675bdcdf0b4406.93518725,library_images/holiday/17642.png,red-tulip,A red tulip/flower with a green stem. Floral motif.
holiday,17643,png,32,32,节日_IDM,ALL,https://images.heaton.com.cn/download/675bdcdf0b4463.28074557,library_images/holiday/17643.png,snowman-3,A white snowman with a red scarf on a blue background. Cheerful winter character.
holiday,17644,png,32,32,节日_IDM,ALL,https://images.heaton.com.cn/download/675bdcdf0b44a1.85665501,library_images/holiday/17644.png,snowman-4,A white snowman on a blue snowy background. Winter character.
holiday,17645,png,32,32,节日_IDM,ALL,https://images.heaton.com.cn/download/675bdcdf0b44e4.52813574,library_images/holiday/17645.png,birthday-cake,A birthday cake with lit candles on a pink background. Celebration treat.
holiday,17646,png,32,32,节日_IDM,ALL,https://images.heaton.com.cn/download/675bdcdf0b4525.11921993,library_images/holiday/17646.png,i-love-you,The message 'I ♥ U' on a dark background. Valentine love note.
holiday,17647,png,32,32,节日_IDM,ALL,https://images.heaton.com.cn/download/675bdcdf0b4562.85380476,library_images/holiday/17647.png,rainbow-heart-5,A rainbow heart with a disco/sparkle effect. Colorful love icon.
holiday,17648,png,32,32,节日_IDM,ALL,https://images.heaton.com.cn/download/675bdcdf0b4591.09222733,library_images/holiday/17648.png,red-heart-12,A red 3D heart on a black background. Love symbol.
holiday,17649,png,32,32,节日_IDM,ALL,https://images.heaton.com.cn/download/675bdcdf0b45d2.58784355,library_images/holiday/17649.png,heart-eyes-pair,A pair of red hearts on a purple background. Love-struck motif.
emoji,17650,png,32,32,表情_IDM,ALL,https://images.heaton.com.cn/download/675bdcdf0b4632.38333821,library_images/emoji/17650.png,letter-b,An orange letter 'B' emblem framed on orange. Initial/badge motif.
emoji,17651,png,32,32,表情_IDM,ALL,https://images.heaton.com.cn/download/675bdcdf0b4675.74136014,library_images/emoji/17651.png,green-frog-4,A green frog face on a dark background. Cute amphibian emoji.
emoji,17652,png,32,32,表情_IDM,ALL,https://images.heaton.com.cn/download/675bdcdf0b46b3.28887025,library_images/emoji/17652.png,love-skull,A white skull with red heart-shaped eyes. Love-struck spooky emoji.
emoji,17653,png,32,32,表情_IDM,ALL,https://images.heaton.com.cn/download/675bdcdf0b46e7.58177519,library_images/emoji/17653.png,skull-6,A white skull on a dark background. Bony emoji.
emoji,17654,png,32,32,表情_IDM,ALL,https://images.heaton.com.cn/download/675bdcdf0b4739.36661217,library_images/emoji/17654.png,grinning-face-2,A black-and-white face with a big toothy grin. Cheeky emoji.
emoji,17655,png,32,32,表情_IDM,ALL,https://images.heaton.com.cn/download/675bdcdf0b4763.16978940,library_images/emoji/17655.png,smiling-heart-2,A pink heart with a grinning face. Happy love emoji.
emoji,17656,png,32,32,表情_IDM,ALL,https://images.heaton.com.cn/download/675bdcdf0b47d1.70873831,library_images/emoji/17656.png,ihl-text,The colorful letters 'IHL' on a dark background. Text/logo motif.
emoji,17657,png,32,32,表情_IDM,ALL,https://images.heaton.com.cn/download/675bdcdf0b4817.02400837,library_images/emoji/17657.png,pink-heart-7,A pink heart with sparkles. Sweet love icon.
emoji,17658,png,32,32,表情_IDM,ALL,https://images.heaton.com.cn/download/675bdcdf0b4854.57488747,library_images/emoji/17658.png,bmo-robot,A green robot face resembling BMO from Adventure Time. Cute gaming bot.
emoji,17659,png,32,32,表情_IDM,ALL,https://images.heaton.com.cn/download/675bdcdf0b4899.65264181,library_images/emoji/17659.png,orange-smiley,An orange smiling face. Cheerful emoji.
emoji,17660,png,32,32,表情_IDM,ALL,https://images.heaton.com.cn/download/675bdcdf0b48d0.41473657,library_images/emoji/17660.png,orange-camera,An orange boxy robot/camera with a screen. Retro gadget.
emoji,17661,png,32,32,表情_IDM,ALL,https://images.heaton.com.cn/download/675bdcdf0b4902.92935761,library_images/emoji/17661.png,knife-figure,A small figure holding a knife/blade. Quirky character scene.
emoji,17662,png,32,32,表情_IDM,ALL,https://images.heaton.com.cn/download/675bdcdf0b4949.52913385,library_images/emoji/17662.png,dotted-heart-2,A heart outline made of colorful dots on black. Twinkling love icon.
emoji,17663,png,32,32,表情_IDM,ALL,https://images.heaton.com.cn/download/675bdcdf0b49a9.44276156,library_images/emoji/17663.png,skull-7,A white skull on a dark background. Spooky emoji.
emoji,17664,png,32,32,表情_IDM,ALL,https://images.heaton.com.cn/download/675bdcdf0b49e3.29898231,library_images/emoji/17664.png,skull-glasses,A yellow skull wearing glasses on a dark background. Studious spooky emoji.
emoji,17665,png,32,32,表情_IDM,ALL,https://images.heaton.com.cn/download/675bdcdf0b4a22.68181640,library_images/emoji/17665.png,nerd-face-2,A yellow nerd face with glasses and a frown. Geeky emoji.
emoji,17666,png,32,32,表情_IDM,ALL,https://images.heaton.com.cn/download/675bdcdf0b4a61.84451442,library_images/emoji/17666.png,glasses-man,A man's face with glasses and brown hair. Bespectacled portrait.
emoji,17667,png,32,32,表情_IDM,ALL,https://images.heaton.com.cn/download/675bdcdf0b4aa1.46323779,library_images/emoji/17667.png,pink-blush-face,"A pink face with heart-shaped cheeks, blushing. Bashful love emoji."
emoji,17668,png,32,32,表情_IDM,ALL,https://images.heaton.com.cn/download/675bdcdf0b4ae1.87600453,library_images/emoji/17668.png,orange-face-2,An orange face with a sad/yawning expression. Tired emoji.
emoji,17669,png,32,32,表情_IDM,ALL,https://images.heaton.com.cn/download/675bdcdf0b4b47.04632681,library_images/emoji/17669.png,glitch-frame,A rainbow-glitch framed face. Distorted digital emoji.
emoji,17670,png,32,32,表情_IDM,ALL,https://images.heaton.com.cn/download/675bdcdf0b4b83.64067629,library_images/emoji/17670.png,brown-creature-2,A brown triangular creature with red eyes on pink. Quirky character.
emoji,17671,png,32,32,表情_IDM,ALL,https://images.heaton.com.cn/download/675bdcdf0b4bc2.70264704,library_images/emoji/17671.png,lemon-face,A yellow lemon with a face. Citrus character emoji.
emoji,17672,png,32,32,表情_IDM,ALL,https://images.heaton.com.cn/download/675bdcdf0b4c07.72809792,library_images/emoji/17672.png,pink-clown-face-2,"A pink face with goofy features, like a clown/troll. Funny emoji."
emoji,17673,png,32,32,表情_IDM,ALL,https://images.heaton.com.cn/download/675bdcdf0b4c36.29113597,library_images/emoji/17673.png,skull-ten-2,A white skull with the number '10'. Spooky countdown motif.
emoji,17674,png,32,32,表情_IDM,ALL,https://images.heaton.com.cn/download/675bdcdf0b4c75.52546041,library_images/emoji/17674.png,pink-monster,A pink monster face with big eyes. Cute creature.
emoji,17675,png,32,32,表情_IDM,ALL,https://images.heaton.com.cn/download/675bdcdf0b4ca8.87283796,library_images/emoji/17675.png,clown-grin-2,A creepy white clown/joker face with a wide grin. Unsettling emoji.
emoji,17676,png,32,32,表情_IDM,ALL,https://images.heaton.com.cn/download/675bdcdf0b4d12.89257549,library_images/emoji/17676.png,black-box-red-eyes,A black box face with red eyes and a smile. Eerie blocky emoji.
emoji,17677,png,32,32,表情_IDM,ALL,https://images.heaton.com.cn/download/675bdcdf0b4d44.61414570,library_images/emoji/17677.png,anime-girl,A blonde anime-style girl face on a red background. Cute character.
emoji,17678,png,32,32,表情_IDM,ALL,https://images.heaton.com.cn/download/675bdcdf0b4d86.73376353,library_images/emoji/17678.png,brown-bear-2,A brown bear/monkey face. Cuddly animal emoji.
emoji,17679,png,32,32,表情_IDM,ALL,https://images.heaton.com.cn/download/675bdcdf0b4dc7.79850181,library_images/emoji/17679.png,gold-laugh,A golden/yellow laughing face. Joyful emoji.
emoji,17680,png,32,32,表情_IDM,ALL,https://images.heaton.com.cn/download/675bdcdf0b4df3.88249427,library_images/emoji/17680.png,gray-smiley,A gray smiling face. Neutral happy emoji.
emoji,17681,png,32,32,表情_IDM,ALL,https://images.heaton.com.cn/download/675bdcdf0b4e31.38333464,library_images/emoji/17681.png,red-face-lines,A red face/mask drawn in line art. Bold expressive emoji.
emoji,17682,png,32,32,表情_IDM,ALL,https://images.heaton.com.cn/download/675bdcdf0b4e64.80637048,library_images/emoji/17682.png,red-heart-13,A red 3D heart on a gray background. Love symbol.
emoji,17683,png,32,32,表情_IDM,ALL,https://images.heaton.com.cn/download/675bdcdf0b4ec0.48515632,library_images/emoji/17683.png,red-robot-4,A red box-shaped robot face with teeth. Blocky mechanical emoji.
emoji,17684,png,32,32,表情_IDM,ALL,https://images.heaton.com.cn/download/675bdcdf0b4f03.76081011,library_images/emoji/17684.png,skull-heart,A white skull/figure with a heart on teal. Spooky-love motif.
emoji,17685,png,32,32,表情_IDM,ALL,https://images.heaton.com.cn/download/675bdcdf0b4f46.62205873,library_images/emoji/17685.png,smiling-heart-3,A red heart with a grinning face. Happy love emoji.
emoji,17686,png,32,32,表情_IDM,ALL,https://images.heaton.com.cn/download/675bdcdf0b4f80.69325483,library_images/emoji/17686.png,yellow-box-smiley,A yellow square face with a smile. Blocky happy emoji.
emoji,17687,png,32,32,表情_IDM,ALL,https://images.heaton.com.cn/download/675bdcdf0b4fc7.88019089,library_images/emoji/17687.png,heart-eyes-3,A yellow face with red heart eyes. 'In love' emoji.
emoji,17688,png,32,32,表情_IDM,ALL,https://images.heaton.com.cn/download/675bdcdf0b5001.09283558,library_images/emoji/17688.png,angry-yellow,A yellow face/chick with an angry expression. Cross emoji.
emoji,17689,png,32,32,表情_IDM,ALL,https://images.heaton.com.cn/download/675bdcdf0b5063.10279301,library_images/emoji/17689.png,gold-laugh-2,A golden laughing face. Joyful emoji.
emoji,17690,png,32,32,表情_IDM,ALL,https://images.heaton.com.cn/download/675bdcdf0b50a3.50148538,library_images/emoji/17690.png,cool-skull,A white skull wearing sunglasses on pink. Cool spooky emoji.
emoji,17691,png,32,32,表情_IDM,ALL,https://images.heaton.com.cn/download/675bdcdf0b50e8.48636652,library_images/emoji/17691.png,rose-snail,A red rose with a snail beside it. Garden/nature motif.
emoji,17692,png,32,32,表情_IDM,ALL,https://images.heaton.com.cn/download/675bdcdf0b5117.39762450,library_images/emoji/17692.png,color-grid-2,A grid of brightly colored squares. Color palette pattern.
emoji,17693,png,32,32,表情_IDM,ALL,https://images.heaton.com.cn/download/675bdcdf0b5154.77412950,library_images/emoji/17693.png,pig-face-3,A pink pig face with a snout. Farm animal emoji.
emoji,17694,png,32,32,表情_IDM,ALL,https://images.heaton.com.cn/download/675bdcdf0b5197.76731278,library_images/emoji/17694.png,heart-faces,A pair of pink hearts with little faces. Love-struck emoji.
emoji,17695,png,32,32,表情_IDM,ALL,https://images.heaton.com.cn/download/675bdcdf0b51d6.38473757,library_images/emoji/17695.png,rose-heart,A red heart formed like a rose with leaves on dark. Romantic flower-heart.
emoji,17696,png,32,32,表情_IDM,ALL,https://images.heaton.com.cn/download/675bdcdf0b5235.31331922,library_images/emoji/17696.png,skull-orange-2,A white skull on an orange background. Halloween emoji.
emoji,17697,png,32,32,表情_IDM,ALL,https://images.heaton.com.cn/download/675bdcdf0b5272.92712507,library_images/emoji/17697.png,glitch-skull-2,A white skull with red glitch distortion. Spooky glitch emoji.
emoji,17698,png,32,32,表情_IDM,ALL,https://images.heaton.com.cn/download/675bdcdf0b52b4.37203223,library_images/emoji/17698.png,white-grin,A white grinning mouth/face on black. Cheeky emoji.
emoji,17699,png,32,32,表情_IDM,ALL,https://images.heaton.com.cn/download/675bdcdf0b52f0.44979325,library_images/emoji/17699.png,glitch-smiley,A black smiley with red/blue glitch on white. Distorted happy emoji.
emoji,17700,png,32,32,表情_IDM,ALL,https://images.heaton.com.cn/download/675bdcdf0b5343.97986837,library_images/emoji/17700.png,red-smiley,A red smiling face on white. Cheerful emoji.
emoji,17701,png,32,32,表情_IDM,ALL,https://images.heaton.com.cn/download/675bdcdf0b5381.11813211,library_images/emoji/17701.png,glitch-smiley-2,A blue/red 3D-glitch smiley on white. Trippy happy emoji.
emoji,17702,png,32,32,表情_IDM,ALL,https://images.heaton.com.cn/download/675bdcdf0b53e2.02166862,library_images/emoji/17702.png,heart-outline-2,A pink-and-blue heart outline on black. Simple love icon.
emoji,17703,png,32,32,表情_IDM,ALL,https://images.heaton.com.cn/download/675bdcdf0b5422.23392860,library_images/emoji/17703.png,green-angry-2,"A green face with red eyes, looking angry. Furious emoji."
emoji,17704,png,32,32,表情_IDM,ALL,https://images.heaton.com.cn/download/675bdcdf0b5459.11916307,library_images/emoji/17704.png,gold-heart-2,A golden/yellow heart on a dark background. Shiny love icon.
emoji,17705,png,32,32,表情_IDM,ALL,https://images.heaton.com.cn/download/675bdcdf0b5494.92257175,library_images/emoji/17705.png,white-ghost-6,A white ghost on a dark background. Halloween spirit.
emoji,17706,png,32,32,表情_IDM,ALL,https://images.heaton.com.cn/download/675bdcdf0b54c1.30950670,library_images/emoji/17706.png,green-grin,A green smiling-face outline on black. Minimal happy emoji.
emoji,17707,png,32,32,表情_IDM,ALL,https://images.heaton.com.cn/download/675bdcdf0b5507.72614614,library_images/emoji/17707.png,yellow-skull-3,A yellow skull on a dark background. Bony emoji.
emoji,17708,png,32,32,表情_IDM,ALL,https://images.heaton.com.cn/download/675bdcdf0b5546.05153648,library_images/emoji/17708.png,red-devil-3,A dark red devil/demon face. Spooky character.
emoji,17709,png,32,32,表情_IDM,ALL,https://images.heaton.com.cn/download/675bdcdf0b55a6.15357813,library_images/emoji/17709.png,thumbs-up-heart-2,A hand giving a thumbs up with a red heart. Like-and-love motif.
emoji,17710,png,32,32,表情_IDM,ALL,https://images.heaton.com.cn/download/675bdcdf0b55d1.93153128,library_images/emoji/17710.png,pink-face-2,A pink blushing face on a pink background. Bashful emoji.
emoji,17711,png,32,32,表情_IDM,ALL,https://images.heaton.com.cn/download/675bdcdf0b5610.37840988,library_images/emoji/17711.png,skull-music,A white skull with a music note. Musical spooky emoji.
emoji,17712,png,32,32,表情_IDM,ALL,https://images.heaton.com.cn/download/675bdcdf0b5653.78583542,library_images/emoji/17712.png,orange-box-robot,An orange boxy robot face with green eyes. Mechanical emoji.
emoji,17713,png,32,32,表情_IDM,ALL,https://images.heaton.com.cn/download/675bdcdf0b5697.37342931,library_images/emoji/17713.png,dizzy-face-2,"A blue face with X-shaped eyes, dizzy/knocked out. Woozy emoji."
emoji,17714,png,32,32,表情_IDM,ALL,https://images.heaton.com.cn/download/675bdcdf0b56d3.20928334,library_images/emoji/17714.png,pink-grin-2,A pink face with a toothy grin. Goofy emoji.
emoji,17715,png,32,32,表情_IDM,ALL,https://images.heaton.com.cn/download/675bdcdf0b5809.63196902,library_images/emoji/17715.png,red-teeth-face,A red box face showing teeth. Bold blocky emoji.
emoji,17716,png,32,32,表情_IDM,ALL,https://images.heaton.com.cn/download/675bdcdf0b5852.32719164,library_images/emoji/17716.png,pig-face-4,A pink pig face. Farm animal emoji.
emoji,17717,png,32,32,表情_IDM,ALL,https://images.heaton.com.cn/download/675bdcdf0b5890.57411556,library_images/emoji/17717.png,diamond-face,A cyan diamond/gem with a face and sparkles. Shiny character emoji.
emoji,17718,png,32,32,表情_IDM,ALL,https://images.heaton.com.cn/download/675bdcdf0b58d9.12007952,library_images/emoji/17718.png,blue-tongue-creature,A blue bird/creature sticking out its tongue on pink. Silly character.
emoji,17719,png,32,32,表情_IDM,ALL,https://images.heaton.com.cn/download/675bdcdf0b5917.36347917,library_images/emoji/17719.png,banana,A yellow banana character. Fruit mascot emoji.
emoji,17720,png,32,32,表情_IDM,ALL,https://images.heaton.com.cn/download/675bdcdf0b5950.03722741,library_images/emoji/17720.png,pink-skull,A pink skull on a purple background. Cute spooky emoji.
emoji,17721,png,32,32,表情_IDM,ALL,https://images.heaton.com.cn/download/675bdcdf0b5995.67301122,library_images/emoji/17721.png,surprised-face,"A black-and-white face with big eyes, surprised, on cyan. Shocked emoji."
creative,17722,png,32,32,创意_IDM,ALL,https://images.heaton.com.cn/download/675bdcdf0b59f8.66847919,library_images/creative/17722.png,sundae,An ice cream sundae dessert served in a glass. Sweet treat.
creative,17723,png,32,32,创意_IDM,ALL,https://images.heaton.com.cn/download/675bdcdf0b5a38.72954235,library_images/creative/17723.png,gray-bomb-2,A gray cartoon bomb with a fuse. Explosive icon.
creative,17724,png,32,32,创意_IDM,ALL,https://images.heaton.com.cn/download/675bdcdf0b5a79.06708406,library_images/creative/17724.png,earth-2,The planet Earth as a blue-and-green globe. Our world icon.
