category,file_id,format,width,height,category_name,label,file_path,local,name,description
daily,17475,png,32,32,日常_IDM,ALL,https://images.heaton.com.cn/download/675bdcdf0b03c6.88757383,library_images/daily/17475.png,open-book,An open white book on a dark background. Reading/study icon.
daily,17476,png,32,32,日常_IDM,ALL,https://images.heaton.com.cn/download/675bdcdf0b0436.27699895,library_images/daily/17476.png,bunny-face-2,A white rabbit face with pink accents on cyan. Cute bunny portrait.
daily,17477,png,32,32,日常_IDM,ALL,https://images.heaton.com.cn/download/675bdcdf0b0499.53447851,library_images/daily/17477.png,full-moon,A gray cratered full moon on a blue background. Night-sky icon.
daily,17478,png,32,32,日常_IDM,ALL,https://images.heaton.com.cn/download/675bdcdf0b0506.49977753,library_images/daily/17478.png,sleeping-cat,A black cat lying down/sleeping on a green background. Resting kitty.
daily,17479,png,32,32,日常_IDM,ALL,https://images.heaton.com.cn/download/675bdcdf0b05a4.15671502,library_images/daily/17479.png,white-cat-2,A white cat/creature with a face. Cute animal portrait.
daily,17480,png,32,32,日常_IDM,ALL,https://images.heaton.com.cn/download/675bdcdf0b0609.64808606,library_images/daily/17480.png,husky,A black-and-white husky/dog face. Canine portrait.
daily,17481,png,32,32,日常_IDM,ALL,https://images.heaton.com.cn/download/675bdcdf0b0675.81465344,library_images/daily/17481.png,gray-person,A simple gray humanoid figure on a blue background. Generic person icon.
daily,17482,png,32,32,日常_IDM,ALL,https://images.heaton.com.cn/download/675bdcdf0b06e1.04856409,library_images/daily/17482.png,bunny-carrot,A white rabbit with a carrot on a blue background. Easter/spring motif.
daily,17483,png,32,32,日常_IDM,ALL,https://images.heaton.com.cn/download/675bdcdf0b0746.35076862,library_images/daily/17483.png,green-dragon,A green dragon/dinosaur face with horns on a dark background. Mythical reptile.
daily,17484,png,32,32,日常_IDM,ALL,https://images.heaton.com.cn/download/675bdcdf0b07b3.95312928,library_images/daily/17484.png,green-dino,A green dinosaur/dragon creature on a gray background. Friendly reptile.
daily,17485,png,32,32,日常_IDM,ALL,https://images.heaton.com.cn/download/675bdcdf0b0827.87764447,library_images/daily/17485.png,sushi-roll-2,A maki sushi roll with colorful filling seen from above. Japanese food icon.
daily,17486,png,32,32,日常_IDM,ALL,https://images.heaton.com.cn/download/675bdcdf0b08b7.74675502,library_images/daily/17486.png,snow-planet,A white snowy planet/moon sphere on a dark background. Wintry celestial body.
daily,17487,png,32,32,日常_IDM,ALL,https://images.heaton.com.cn/download/675bdcdf0b0919.67478399,library_images/daily/17487.png,man-face-2,A man's face with gray hair and a blue shirt. Person portrait.
daily,17488,png,32,32,日常_IDM,ALL,https://images.heaton.com.cn/download/675bdcdf0b0984.62171863,library_images/daily/17488.png,white-ghost-3,A white ghost on a dark background. Halloween spirit.
daily,17489,png,32,32,日常_IDM,ALL,https://images.heaton.com.cn/download/675bdcdf0b09f4.43603822,library_images/daily/17489.png,gray-figure,A gray ghost/figure with a pale face on blue. Simple character.
daily,17490,png,32,32,日常_IDM,ALL,https://images.heaton.com.cn/download/675bdcdf0b0a56.20901505,library_images/daily/17490.png,cherries,A pair of red cherries on a pink background. Fruit icon.
daily,17491,png,32,32,日常_IDM,ALL,https://images.heaton.com.cn/download/675bdcdf0b0ab4.17380959,library_images/daily/17491.png,tan-animal,A tan cat/rabbit face on an orange background. Cute animal portrait.
daily,17492,png,32,32,日常_IDM,ALL,https://images.heaton.com.cn/download/675bdcdf0b0b45.47338156,library_images/daily/17492.png,red-fruit,A red apple/cherry on a green background. Fruit icon.
daily,17493,png,32,32,日常_IDM,ALL,https://images.heaton.com.cn/download/675bdcdf0b0bb3.64766395,library_images/daily/17493.png,bulldog,A French bulldog face on a dark background. Canine portrait.
daily,17494,png,32,32,日常_IDM,ALL,https://images.heaton.com.cn/download/675bdcdf0b0c29.28364928,library_images/daily/17494.png,green-creature-2,A green frog/turtle creature on a dark background. Amphibian/reptile.
daily,17495,png,32,32,日常_IDM,ALL,https://images.heaton.com.cn/download/675bdcdf0b0c89.93686847,library_images/daily/17495.png,pride-flag,A colorful rainbow/pride flag on a pole in a landscape. Flag motif.
daily,17496,png,32,32,日常_IDM,ALL,https://images.heaton.com.cn/download/675bdcdf0b0cf3.56953198,library_images/daily/17496.png,fireplace-room,A cozy brown room with a fireplace. Warm interior scene.
daily,17497,png,32,32,日常_IDM,ALL,https://images.heaton.com.cn/download/675bdcdf0b0d66.17607320,library_images/daily/17497.png,black-bat,A black bat/spider creature on a dark background. Spooky animal.
daily,17498,png,32,32,日常_IDM,ALL,https://images.heaton.com.cn/download/675bdcdf0b0dc3.78478023,library_images/daily/17498.png,boy-face,A boy's face with brown hair and a green shirt. Person portrait.
daily,17499,png,32,32,日常_IDM,ALL,https://images.heaton.com.cn/download/675bdcdf0b0e50.22878569,library_images/daily/17499.png,thumbs-up-2,A blue hand giving a thumbs up. Approval gesture.
daily,17500,png,32,32,日常_IDM,ALL,https://images.heaton.com.cn/download/675bdcdf0b0ec0.30765321,library_images/daily/17500.png,black-cat,A black cat face with glowing eyes on dark. Spooky kitty.
daily,17501,png,32,32,日常_IDM,ALL,https://images.heaton.com.cn/download/675bdcdf0b0f35.68674890,library_images/daily/17501.png,rainbow-heart-4,A heart made of concentric rainbow bands. Colorful love symbol.
daily,17502,png,32,32,日常_IDM,ALL,https://images.heaton.com.cn/download/675bdcdf0b0fd6.67521976,library_images/daily/17502.png,zombie-2,A green zombie/Frankenstein face. Spooky monster portrait.
daily,17503,png,32,32,日常_IDM,ALL,https://images.heaton.com.cn/download/675bdcdf0b1045.58963295,library_images/daily/17503.png,brown-dog,A brown puppy/dog face on a tan background. Cute canine.
daily,17504,png,32,32,日常_IDM,ALL,https://images.heaton.com.cn/download/675bdcdf0b10b9.94437934,library_images/daily/17504.png,cat-moon-night,A cat gazing at the moon in a snowy night scene. Peaceful nocturnal vignette.
daily,17505,png,32,32,日常_IDM,ALL,https://images.heaton.com.cn/download/675bdcdf0b1142.41602121,library_images/daily/17505.png,red-gnome,A red gnome/figure in a pointed Santa-style hat. Whimsical character.
daily,17506,png,32,32,日常_IDM,ALL,https://images.heaton.com.cn/download/675bdcdf0b11b4.33498609,library_images/daily/17506.png,clover,A green four-leaf clover/shamrock on a dark background. Luck motif.
daily,17507,png,32,32,日常_IDM,ALL,https://images.heaton.com.cn/download/675bdcdf0b1228.57602359,library_images/daily/17507.png,mushroom-cat,A white cat/bear wearing a mushroom-shaped hat on cyan. Cute creature.
daily,17508,png,32,32,日常_IDM,ALL,https://images.heaton.com.cn/download/675bdcdf0b1293.84145357,library_images/daily/17508.png,cap-mask-person,A character with a green 'H' cap and a mask. Costumed person portrait.
daily,17509,png,32,32,日常_IDM,ALL,https://images.heaton.com.cn/download/675bdcdf0b1306.20882418,library_images/daily/17509.png,dog-heart,A brown dog with a heart on a pink background. Affectionate pet motif.
daily,17510,png,32,32,日常_IDM,ALL,https://images.heaton.com.cn/download/675bdcdf0b1365.24102926,library_images/daily/17510.png,parrot,A red-and-green parrot. Colorful tropical bird.
daily,17511,png,32,32,日常_IDM,ALL,https://images.heaton.com.cn/download/675bdcdf0b13d4.62428470,library_images/daily/17511.png,burger,A loaded hamburger with bun and fillings. Fast-food icon.
daily,17512,png,32,32,日常_IDM,ALL,https://images.heaton.com.cn/download/675bdcdf0b1461.78664810,library_images/daily/17512.png,wolf-face,A brown wolf/cat face with blue accents. Canine/feline portrait.
daily,17513,png,32,32,日常_IDM,ALL,https://images.heaton.com.cn/download/675bdcdf0b14d7.57542827,library_images/daily/17513.png,iron-man-2,A red-and-gold Iron Man helmet on yellow. Superhero mask.
daily,17514,png,32,32,日常_IDM,ALL,https://images.heaton.com.cn/download/675bdcdf0b1532.40959023,library_images/daily/17514.png,gingerbread-man,A brown gingerbread-man cookie figure. Holiday baking treat.
daily,17515,png,32,32,日常_IDM,ALL,https://images.heaton.com.cn/download/675bdcdf0b15a1.64984254,library_images/daily/17515.png,yellow-duck,A yellow duck/chick. Cute bird icon.
daily,17516,png,32,32,日常_IDM,ALL,https://images.heaton.com.cn/download/675bdcdf0b1601.24024583,library_images/daily/17516.png,brown-monkey,A brown monkey/bear character in a scene. Animal portrait.
daily,17517,png,32,32,日常_IDM,ALL,https://images.heaton.com.cn/download/675bdcdf0b1670.71164463,library_images/daily/17517.png,gray-pyramid,A gray striped pyramid/mountain with a red top. Geometric peak.
daily,17518,png,32,32,日常_IDM,ALL,https://images.heaton.com.cn/download/675bdcdf0b1702.70687253,library_images/daily/17518.png,white-smiley-2,A round white smiling face on a blue background. Happy emoji.
daily,17519,png,32,32,日常_IDM,ALL,https://images.heaton.com.cn/download/675bdcdf0b1768.17737542,library_images/daily/17519.png,green-alien-2,A green alien/creature with arms on a black background. Quirky extraterrestrial.
daily,17520,png,32,32,日常_IDM,ALL,https://images.heaton.com.cn/download/675bdcdf0b17d7.43336034,library_images/daily/17520.png,brown-cat,A brown cat face on a blue background. Feline portrait.
daily,17521,png,32,32,日常_IDM,ALL,https://images.heaton.com.cn/download/675bdcdf0b1836.93166832,library_images/daily/17521.png,green-frog-2,A green frog/monster with big eyes on gray. Goofy amphibian.
daily,17522,png,32,32,日常_IDM,ALL,https://images.heaton.com.cn/download/675bdcdf0b1897.91898178,library_images/daily/17522.png,tan-cat,A tan cat/raccoon face with whiskers. Cute animal portrait.
daily,17523,png,32,32,日常_IDM,ALL,https://images.heaton.com.cn/download/675bdcdf0b1904.30788370,library_images/daily/17523.png,campfire-scene,A dark scene with a glowing campfire and a figure. Cozy nighttime vignette.
daily,17524,png,32,32,日常_IDM,ALL,https://images.heaton.com.cn/download/675bdcdf0b1967.12849920,library_images/daily/17524.png,raccoon-face,A gray-and-white raccoon/panda face on a dark background. Cute animal portrait.
daily,17525,png,32,32,日常_IDM,ALL,https://images.heaton.com.cn/download/675bdcdf0b19f7.36311320,library_images/daily/17525.png,red-gold-pattern,A decorative pattern of gold shapes on red. Festive ornamental design.
daily,17526,png,32,32,日常_IDM,ALL,https://images.heaton.com.cn/download/675bdcdf0b1a64.76264878,library_images/daily/17526.png,penguins,Two black-and-white penguins on a blue background. Polar birds.
daily,17527,png,32,32,日常_IDM,ALL,https://images.heaton.com.cn/download/675bdcdf0b1ad4.39408545,library_images/daily/17527.png,gray-wolf-2,A gray wolf face with red eyes on blue. Fierce canine portrait.
daily,17528,png,32,32,日常_IDM,ALL,https://images.heaton.com.cn/download/675bdcdf0b1b45.38690128,library_images/daily/17528.png,reindeer-2,A brown reindeer/deer on a blue background. Antlered animal.
daily,17529,png,32,32,日常_IDM,ALL,https://images.heaton.com.cn/download/675bdcdf0b1bb4.57278020,library_images/daily/17529.png,gold-coin,A round gold coin on a dark background. Money/treasure icon.
daily,17530,png,32,32,日常_IDM,ALL,https://images.heaton.com.cn/download/675bdcdf0b1c18.36923296,library_images/daily/17530.png,ghost-waving,A white ghost waving on a dark background. Friendly Halloween spirit.
daily,17531,png,32,32,日常_IDM,ALL,https://images.heaton.com.cn/download/675bdcdf0b1c86.33920153,library_images/daily/17531.png,bear-face-2,A brown bear/teddy face on a dark background. Cuddly animal.
daily,17532,png,32,32,日常_IDM,ALL,https://images.heaton.com.cn/download/675bdcdf0b1d47.72595008,library_images/daily/17532.png,snowy-tree,A white snow-covered tree on a blue background. Winter scene.
daily,17533,png,32,32,日常_IDM,ALL,https://images.heaton.com.cn/download/675bdcdf0b1db5.79599505,library_images/daily/17533.png,tomato,A red tomato with a little face. Cheerful vegetable character.
daily,17534,png,32,32,日常_IDM,ALL,https://images.heaton.com.cn/download/675bdcdf0b1e11.60721242,library_images/daily/17534.png,stocking,A red Christmas stocking. Festive holiday decoration.
daily,17535,png,32,32,日常_IDM,ALL,https://images.heaton.com.cn/download/675bdcdf0b1e86.54921230,library_images/daily/17535.png,floral-pattern,A repeating floral pattern of flowers on blue. Decorative wallpaper motif.
daily,17536,png,32,32,日常_IDM,ALL,https://images.heaton.com.cn/download/675bdcdf0b1ef3.24669471,library_images/daily/17536.png,lava-sunset,An orange-and-red lava/sunset landscape. Fiery horizon scene.
daily,17537,png,32,32,日常_IDM,ALL,https://images.heaton.com.cn/download/675bdcdf0b1f67.29474957,library_images/daily/17537.png,crab,A red crab on sand. Seaside creature.
daily,17538,png,32,32,日常_IDM,ALL,https://images.heaton.com.cn/download/675bdcdf0b1ff0.69337413,library_images/daily/17538.png,torch,A flaming torch on a stick against black. Fire/light motif.
daily,17539,png,32,32,日常_IDM,ALL,https://images.heaton.com.cn/download/675bdcdf0b2052.65940683,library_images/daily/17539.png,grapes,Purple bunches of grapes on a black background. Fruit icon.
daily,17540,png,32,32,日常_IDM,ALL,https://images.heaton.com.cn/download/675bdcdf0b20c8.41661412,library_images/daily/17540.png,sunset-runner,A silhouette figure running against a red-and-yellow sunset. Dramatic scene.
daily,17541,png,32,32,日常_IDM,ALL,https://images.heaton.com.cn/download/675bdcdf0b2130.87953370,library_images/daily/17541.png,green-antler-creature,A green frog/monster with antlers on a blue background. Quirky creature.
daily,17542,png,32,32,日常_IDM,ALL,https://images.heaton.com.cn/download/675bdcdf0b21a1.60910749,library_images/daily/17542.png,dog-scarf,A brown dog wearing a scarf on a blue background. Cozy pet portrait.
daily,17543,png,32,32,日常_IDM,ALL,https://images.heaton.com.cn/download/675bdcdf0b2213.02284960,library_images/daily/17543.png,sunny-garden,A sun shining over flowers on a blue background. Cheerful garden scene.
daily,17544,png,32,32,日常_IDM,ALL,https://images.heaton.com.cn/download/675bdcdf0b2278.39189629,library_images/daily/17544.png,dolphin-sky,A gray dolphin/shark leaping against a blue cloudy sky. Whimsical aquatic-aerial scene.
daily,17545,png,32,32,日常_IDM,ALL,https://images.heaton.com.cn/download/675bdcdf0b2304.24885284,library_images/daily/17545.png,green-field-2,A green landscape with trees and plants. Simple nature scene.
daily,17546,png,32,32,日常_IDM,ALL,https://images.heaton.com.cn/download/675bdcdf0b2363.74322180,library_images/daily/17546.png,yellow-duck-2,A yellow duck/chick on a blue background. Cute bird.
daily,17547,png,32,32,日常_IDM,ALL,https://images.heaton.com.cn/download/675bdcdf0b23d6.00128790,library_images/daily/17547.png,purple-flame,A purple flame/bonfire on a dark background. Mystical fire motif.
daily,17548,png,32,32,日常_IDM,ALL,https://images.heaton.com.cn/download/675bdcdf0b2430.01482940,library_images/daily/17548.png,red-balloon,A red balloon floating in a blue sky. Cheerful party motif.
daily,17549,png,32,32,日常_IDM,ALL,https://images.heaton.com.cn/download/675bdcdf0b24a3.26587306,library_images/daily/17549.png,radish,A red radish/tomato root vegetable with a leaf. Produce icon.
daily,17550,png,32,32,日常_IDM,ALL,https://images.heaton.com.cn/download/675bdcdf0b2511.02109365,library_images/daily/17550.png,green-dino-2,A green spotted dinosaur/turtle creature on blue. Friendly reptile.
daily,17551,png,32,32,日常_IDM,ALL,https://images.heaton.com.cn/download/675bdcdf0b25b0.54028308,library_images/daily/17551.png,moon-figure,A small figure with a star standing on a gray rock/moon. Space vignette.
daily,17552,png,32,32,日常_IDM,ALL,https://images.heaton.com.cn/download/675bdcdf0b2613.23413073,library_images/daily/17552.png,gray-robot-2,A gray robot with a yellow face on a gray background. Mechanical character.
daily,17553,png,32,32,日常_IDM,ALL,https://images.heaton.com.cn/download/675bdcdf0b2673.89746974,library_images/daily/17553.png,white-goose,A white duck/goose on a dark background. Bird portrait.
daily,17554,png,32,32,日常_IDM,ALL,https://images.heaton.com.cn/download/675bdcdf0b26e5.50682651,library_images/daily/17554.png,ice-cream-2,A pink ice cream cone. Sweet frozen treat.
daily,17555,png,32,32,日常_IDM,ALL,https://images.heaton.com.cn/download/675bdcdf0b2749.65606703,library_images/daily/17555.png,gold-rings,Two golden rings/circles on a black background. Jewelry/loop motif.
daily,17556,png,32,32,日常_IDM,ALL,https://images.heaton.com.cn/download/675bdcdf0b27b8.49844443,library_images/daily/17556.png,green-frog-3,A green frog/turtle creature on a cyan background. Cute amphibian.
daily,17557,png,32,32,日常_IDM,ALL,https://images.heaton.com.cn/download/675bdcdf0b2813.77562183,library_images/daily/17557.png,rainbow-ufo,A colorful rainbow alien/UFO craft on a dark background. Sci-fi creature.
daily,17558,png,32,32,日常_IDM,ALL,https://images.heaton.com.cn/download/675bdcdf0b28a9.83846420,library_images/daily/17558.png,wolf-sunburst,A gray wolf/lion framed by an orange sunburst. Dramatic animal portrait.
daily,17559,png,32,32,日常_IDM,ALL,https://images.heaton.com.cn/download/675bdcdf0b2904.17331192,library_images/daily/17559.png,red-robot-3,A red box-shaped robot/monster face with teeth. Blocky creature.
daily,17560,png,32,32,日常_IDM,ALL,https://images.heaton.com.cn/download/675bdcdf0b2971.79218093,library_images/daily/17560.png,blue-character-2,A blue-and-white penguin/snowman-like character with red accents. Cute mascot.
daily,17561,png,32,32,日常_IDM,ALL,https://images.heaton.com.cn/download/675bdcdf0b29d8.29470588,library_images/daily/17561.png,stacked-faces,Two stacked emoji faces (blue and pink). Paired character motif.
daily,17562,png,32,32,日常_IDM,ALL,https://images.heaton.com.cn/download/675bdcdf0b2a44.16507957,library_images/daily/17562.png,color-circle,"A circle split into red, yellow and black segments on dark. Abstract color wheel."
daily,17563,png,32,32,日常_IDM,ALL,https://images.heaton.com.cn/download/675bdcdf0b2ab7.11933702,library_images/daily/17563.png,red-hat-character,"A character in a red hat, like a clown or magician, on yellow. Playful figure."
daily,17564,png,32,32,日常_IDM,ALL,https://images.heaton.com.cn/download/675bdcdf0b2b54.13903243,library_images/daily/17564.png,masked-face-2,A face wearing a mask on a purple background. Health/disguise motif.
daily,17565,png,32,32,日常_IDM,ALL,https://images.heaton.com.cn/download/675bdcdf0b2bc8.96167224,library_images/daily/17565.png,eyes-dark,Two glowing white eyes peering out of the dark. Spooky 'something watching' motif.
daily,17566,png,32,32,日常_IDM,ALL,https://images.heaton.com.cn/download/675bdcdf0b2c21.63716561,library_images/daily/17566.png,alarm-clock,A red alarm clock. Time/wake-up icon.
daily,17567,png,32,32,日常_IDM,ALL,https://images.heaton.com.cn/download/675bdcdf0b2c90.88182079,library_images/daily/17567.png,eating-face,A face eating or yawning with food. Hungry/sleepy emoji.
daily,17568,png,32,32,日常_IDM,ALL,https://images.heaton.com.cn/download/675bdcdf0b2d00.00809453,library_images/daily/17568.png,burger-2,A loaded hamburger with lettuce and cheese. Fast-food icon.
daily,17569,png,32,32,日常_IDM,ALL,https://images.heaton.com.cn/download/675bdcdf0b2d74.25667455,library_images/daily/17569.png,no-sign,A red prohibition/no-entry sign with a slash. Forbidden symbol.
daily,17570,png,32,32,日常_IDM,ALL,https://images.heaton.com.cn/download/675bdcdf0b2dd9.72895299,library_images/daily/17570.png,sleeping-desk,A blonde person resting/sleeping at a desk. Tired-at-work scene.
daily,17571,png,32,32,日常_IDM,ALL,https://images.heaton.com.cn/download/675bdcdf0b2ef1.65969633,library_images/daily/17571.png,rice-bowl-2,A bowl of rice/soup with greens. Warm meal icon.
daily,17572,png,32,32,日常_IDM,ALL,https://images.heaton.com.cn/download/675bdcdf0b2f52.57916543,library_images/daily/17572.png,yellow-sleep,"A yellow blob/pillow shape with 'Zzz', sleeping. Drowsy motif."
daily,17573,png,32,32,日常_IDM,ALL,https://images.heaton.com.cn/download/675bdcdf0b2fb6.62409893,library_images/daily/17573.png,red-coffee,A red cup of steaming coffee. Hot beverage icon.
daily,17574,png,32,32,日常_IDM,ALL,https://images.heaton.com.cn/download/675bdcdf0b3017.12633272,library_images/daily/17574.png,weightlifter,A muscular figure lifting a barbell. Strength/fitness motif.
daily,17575,png,32,32,日常_IDM,ALL,https://images.heaton.com.cn/download/675bdcdf0b3075.75470690,library_images/daily/17575.png,duck-bowl-2,A white duck peeking out of a bowl. Quirky food-or-pet motif.
daily,17576,png,32,32,日常_IDM,ALL,https://images.heaton.com.cn/download/675bdcdf0b30c1.73361209,library_images/daily/17576.png,blue-bunny-2,A blue rabbit/cat on a blue background. Cute bunny.
daily,17577,png,32,32,日常_IDM,ALL,https://images.heaton.com.cn/download/675bdcdf0b3140.22589544,library_images/daily/17577.png,sleeping-animal,A cat/fox sleeping with 'Zzz' on a dark background. Resting pet.
daily,17578,png,32,32,日常_IDM,ALL,https://images.heaton.com.cn/download/675bdcdf0b3198.11053022,library_images/daily/17578.png,pink-hearts-2,A pink heart with an arrow and little hearts. Love motif.
daily,17579,png,32,32,日常_IDM,ALL,https://images.heaton.com.cn/download/675bdcdf0b31c6.80363536,library_images/daily/17579.png,pizza-slice-2,A single slice of pepperoni pizza. Food icon.
holiday,17580,png,32,32,节日_IDM,ALL,https://images.heaton.com.cn/download/675bdcdf0b3209.68843855,library_images/holiday/17580.png,white-cat-3,A white cat outline on a dark background. Minimal feline.
holiday,17581,png,32,32,节日_IDM,ALL,https://images.heaton.com.cn/download/675bdcdf0b3246.59710281,library_images/holiday/17581.png,halloween-cat,A black cat with pumpkins. Spooky Halloween scene.
holiday,17582,png,32,32,节日_IDM,ALL,https://images.heaton.com.cn/download/675bdcdf0b3281.48537957,library_images/holiday/17582.png,jack-o-lantern-3,An orange jack-o'-lantern pumpkin with a green stem. Halloween icon.
holiday,17583,png,32,32,节日_IDM,ALL,https://images.heaton.com.cn/download/675bdcdf0b32c9.62027472,library_images/holiday/17583.png,bat,A dark bat on a maroon background. Halloween creature.
holiday,17584,png,32,32,节日_IDM,ALL,https://images.heaton.com.cn/download/675bdcdf0b3331.48942612,library_images/holiday/17584.png,skull-blue-eyes,A white skull/ghost with glowing blue eyes on red. Spooky Halloween face.
holiday,17585,png,32,32,节日_IDM,ALL,https://images.heaton.com.cn/download/675bdcdf0b3375.25612208,library_images/holiday/17585.png,zombie-hand,A green zombie creature/hand on a dark background. Undead Halloween motif.
holiday,17586,png,32,32,节日_IDM,ALL,https://images.heaton.com.cn/download/675bdcdf0b33b8.63891148,library_images/holiday/17586.png,jack-o-lantern-4,A grinning jack-o'-lantern pumpkin with sparkles. Halloween icon.
holiday,17587,png,32,32,节日_IDM,ALL,https://images.heaton.com.cn/download/675bdcdf0b33e6.85331283,library_images/holiday/17587.png,glowing-eyes,A dark creature with glowing eyes peering from black. Lurking-monster motif.
holiday,17588,png,32,32,节日_IDM,ALL,https://images.heaton.com.cn/download/675bdcdf0b3426.40139608,library_images/holiday/17588.png,yellow-bat,A yellow bat/creature shape on a black background. Halloween animal.
holiday,17589,png,32,32,节日_IDM,ALL,https://images.heaton.com.cn/download/675bdcdf0b3462.89401603,library_images/holiday/17589.png,frankenstein,A green Frankenstein's-monster face. Classic Halloween creature.
holiday,17590,png,32,32,节日_IDM,ALL,https://images.heaton.com.cn/download/675bdcdf0b34a9.76821488,library_images/holiday/17590.png,orange-box-face,An orange boxy robot/pumpkin face. Halloween character.
holiday,17591,png,32,32,节日_IDM,ALL,https://images.heaton.com.cn/download/675bdcdf0b3503.19694531,library_images/holiday/17591.png,skull-4,A white skull on a dark background. Bony Halloween motif.
holiday,17592,png,32,32,节日_IDM,ALL,https://images.heaton.com.cn/download/675bdcdf0b3545.32550370,library_images/holiday/17592.png,white-ghost-4,A white ghost with red accents on dark. Halloween spirit.
holiday,17593,png,32,32,节日_IDM,ALL,https://images.heaton.com.cn/download/675bdcdf0b3582.78152330,library_images/holiday/17593.png,witch-pumpkin,A jack-o'-lantern wearing a witch hat on cyan. Halloween mashup.
holiday,17594,png,32,32,节日_IDM,ALL,https://images.heaton.com.cn/download/675bdcdf0b35c8.69589157,library_images/holiday/17594.png,jack-o-lantern-5,A glowing jack-o'-lantern on a purple background. Halloween pumpkin.
holiday,17595,png,32,32,节日_IDM,ALL,https://images.heaton.com.cn/download/675bdcdf0b3608.17946436,library_images/holiday/17595.png,white-ghost-5,A white ghost on a dark background. Halloween spirit.
holiday,17596,png,32,32,节日_IDM,ALL,https://images.heaton.com.cn/download/675bdcdf0b3639.61552419,library_images/holiday/17596.png,skeleton-2,A white skeleton figure on a purple/orange background. Halloween bones.
holiday,17597,png,32,32,节日_IDM,ALL,https://images.heaton.com.cn/download/675bdcdf0b36a4.22169071,library_images/holiday/17597.png,red-devil-2,A red devil/demon face with horns on dark. Spooky character.
holiday,17598,png,32,32,节日_IDM,ALL,https://images.heaton.com.cn/download/675bdcdf0b36e9.37893883,library_images/holiday/17598.png,witch,A purple witch with a pointed hat. Halloween character.
