category,file_id,format,width,height,category_name,label,file_path,local,name,description
daily,15498,gif,16,16,日常_IDM,ALL,https://images.heaton.com.cn/download/675bdcdf061494.25650921,library_16/daily/15498.gif,sleeping-cat,A black cat lying down/sleeping on a green background. Resting kitty.
daily,15499,gif,16,16,日常_IDM,ALL,https://images.heaton.com.cn/download/675bdcdf0614d2.70799690,library_16/daily/15499.gif,white-robot,A white robot/dog with glowing yellow eyes on cream. Cute mechanical creature.
daily,15500,gif,16,16,日常_IDM,ALL,https://images.heaton.com.cn/download/675bdcdf061516.24004616,library_16/daily/15500.gif,spooky-figure,A pale skeleton/witch-like figure with green hair on a dark background. Halloween character.
daily,15501,gif,16,16,日常_IDM,ALL,https://images.heaton.com.cn/download/675bdcdf061552.50879028,library_16/daily/15501.gif,brown-crab,A brown crab/scorpion creature on a dark background. Critter.
daily,15502,gif,16,16,日常_IDM,ALL,https://images.heaton.com.cn/download/675bdcdf061597.93307735,library_16/daily/15502.gif,starfish,A red-orange starfish/sea star on a blue background. Ocean creature.
daily,15503,gif,16,16,日常_IDM,ALL,https://images.heaton.com.cn/download/675bdcdf0615c2.58111502,library_16/daily/15503.gif,cherries,A pair of red cherries on a pink background. Fruit icon.
daily,15504,gif,16,16,日常_IDM,ALL,https://images.heaton.com.cn/download/675bdcdf061615.10525088,library_16/daily/15504.gif,landscape,A simple landscape of blue sky with clouds over ground. Scenery.
daily,15505,gif,16,16,日常_IDM,ALL,https://images.heaton.com.cn/download/675bdcdf061652.48894024,library_16/daily/15505.gif,bowtie-figure,A small creature/figure with a red bow on a dark background. Costumed character.
daily,15506,gif,16,16,日常_IDM,ALL,https://images.heaton.com.cn/download/675bdcdf061693.53777720,library_16/daily/15506.gif,purple-monster,A purple monster/bat face on a dark background. Spooky creature.
daily,15507,gif,16,16,日常_IDM,ALL,https://images.heaton.com.cn/download/675bdcdf0616d5.93702160,library_16/daily/15507.gif,star-ball,A round green creature with a star and a red bandana. Quirky mascot.
daily,15508,gif,16,16,日常_IDM,ALL,https://images.heaton.com.cn/download/675bdcdf061701.43907515,library_16/daily/15508.gif,brick-wall,"A brick wall with red-and-white accents, like a fireplace. Interior scene."
daily,15509,gif,16,16,日常_IDM,ALL,https://images.heaton.com.cn/download/675bdcdf061741.54020879,library_16/daily/15509.gif,flan,A custard/flan pudding dessert on a plate. Sweet treat.
daily,15510,gif,16,16,日常_IDM,ALL,https://images.heaton.com.cn/download/675bdcdf061798.98966280,library_16/daily/15510.gif,red-mug,A red coffee mug on a pink background. Hot-drink icon.
daily,15511,gif,16,16,日常_IDM,ALL,https://images.heaton.com.cn/download/675bdcdf061862.65491637,library_16/daily/15511.gif,food-plate,A plate of pink-and-orange food (shrimp/dumplings) on cream. Meal icon.
daily,15512,gif,16,16,日常_IDM,ALL,https://images.heaton.com.cn/download/675bdcdf0618c1.50078600,library_16/daily/15512.gif,toiletries,"Blue bottles and a cup, like bathroom toiletries. Grooming items."
daily,15513,gif,16,16,日常_IDM,ALL,https://images.heaton.com.cn/download/675bdcdf061920.57349178,library_16/daily/15513.gif,yellow-duck,A yellow duck/bird on a green background. Cute bird.
daily,15514,gif,16,16,日常_IDM,ALL,https://images.heaton.com.cn/download/675bdcdf061968.27946773,library_16/daily/15514.gif,checkered-room,A white figure standing on a blue checkered floor. Indoor character scene.
daily,15515,gif,16,16,日常_IDM,ALL,https://images.heaton.com.cn/download/675bdcdf0619b9.41163313,library_16/daily/15515.gif,masked-face,A face wearing a green mask/scarf on a pink background. Masked person.
daily,15516,gif,16,16,日常_IDM,ALL,https://images.heaton.com.cn/download/675bdcdf0619e0.20264290,library_16/daily/15516.gif,blonde-boy,A blonde boy's face on a blue background. Kid portrait.
daily,15517,gif,16,16,日常_IDM,ALL,https://images.heaton.com.cn/download/675bdcdf061a30.86557048,library_16/daily/15517.gif,donut,A brown ring shape like a donut or tire on cream. Round object.
daily,15518,gif,16,16,日常_IDM,ALL,https://images.heaton.com.cn/download/675bdcdf061a85.41845661,library_16/daily/15518.gif,cave,A dark cave/archway tunnel on a dark background. Mysterious passage.
daily,15519,gif,16,16,日常_IDM,ALL,https://images.heaton.com.cn/download/675bdcdf061ab0.27311189,library_16/daily/15519.gif,noodle-bowl,A bowl of noodles/food with toppings on red. Meal icon.
daily,15520,gif,16,16,日常_IDM,ALL,https://images.heaton.com.cn/download/675bdcdf061af9.06356309,library_16/daily/15520.gif,water-bottle,A clear water bottle on a blue background. Hydration icon.
daily,15521,gif,16,16,日常_IDM,ALL,https://images.heaton.com.cn/download/675bdcdf061b30.58284706,library_16/daily/15521.gif,hand-flask,A hand holding a blue test tube/flask on blue. Science/experiment motif.
daily,15522,gif,16,16,日常_IDM,ALL,https://images.heaton.com.cn/download/675bdcdf061b75.81496248,library_16/daily/15522.gif,food-bowl,A bowl of creamy food/coffee on a red background. Meal icon.
daily,15523,gif,16,16,日常_IDM,ALL,https://images.heaton.com.cn/download/675bdcdf061bb2.62818997,library_16/daily/15523.gif,white-flower,A white flower/cloud shape on a blue background. Floral motif.
daily,15524,gif,16,16,日常_IDM,ALL,https://images.heaton.com.cn/download/675bdcdf061c00.62955029,library_16/daily/15524.gif,field-scene,A scene with small figures on green grass. Outdoor game vignette.
daily,15525,gif,16,16,日常_IDM,ALL,https://images.heaton.com.cn/download/675bdcdf061c40.87521701,library_16/daily/15525.gif,ballerina,A pink ballerina dancing on a dark background. Dancer figure.
daily,15526,gif,16,16,日常_IDM,ALL,https://images.heaton.com.cn/download/675bdcdf061c86.69736037,library_16/daily/15526.gif,blue-cup,A blue cup/mug with steam on a dark background. Hot drink.
daily,15527,gif,16,16,日常_IDM,ALL,https://images.heaton.com.cn/download/675bdcdf061cc9.24144152,library_16/daily/15527.gif,santa-scene,A festive scene with red-and-white Santa figures. Christmas vignette.
daily,15528,gif,16,16,日常_IDM,ALL,https://images.heaton.com.cn/download/675bdcdf061d04.71879374,library_16/daily/15528.gif,teacup,A cup of coffee on a pink saucer. Hot-beverage icon.
daily,15529,gif,16,16,日常_IDM,ALL,https://images.heaton.com.cn/download/675bdcdf061d33.01910383,library_16/daily/15529.gif,burger,A hamburger on a striped background. Fast-food icon.
daily,15530,gif,16,16,日常_IDM,ALL,https://images.heaton.com.cn/download/675bdcdf061d85.47291128,library_16/daily/15530.gif,battery,A white battery outline on black. Power/charge icon.
daily,15531,gif,16,16,日常_IDM,ALL,https://images.heaton.com.cn/download/675bdcdf061db4.98913950,library_16/daily/15531.gif,potted-flower,A pink flower/plant in a pot on green. Potted greenery.
daily,15532,gif,16,16,日常_IDM,ALL,https://images.heaton.com.cn/download/675bdcdf061df9.97475860,library_16/daily/15532.gif,sushi-nigiri,A piece of shrimp nigiri sushi on a dark background. Japanese food.
daily,15533,gif,16,16,日常_IDM,ALL,https://images.heaton.com.cn/download/675bdcdf061e32.52188220,library_16/daily/15533.gif,sushi-roll,A maki sushi roll on a pink background. Japanese food icon.
daily,15534,gif,16,16,日常_IDM,ALL,https://images.heaton.com.cn/download/675bdcdf061e70.09281730,library_16/daily/15534.gif,pink-donut,A pink donut/creature on a green background. Sweet character.
daily,15535,gif,16,16,日常_IDM,ALL,https://images.heaton.com.cn/download/675bdcdf061eb4.77980028,library_16/daily/15535.gif,chocolate-donut,A chocolate donut on a dark background. Sweet treat.
daily,15536,gif,16,16,日常_IDM,ALL,https://images.heaton.com.cn/download/675bdcdf061ef5.63181265,library_16/daily/15536.gif,yellow-mug,A yellow mug/cup in a small scene. Beverage icon.
daily,15537,gif,16,16,日常_IDM,ALL,https://images.heaton.com.cn/download/675bdcdf061f21.31508731,library_16/daily/15537.gif,brown-circle,A brown round object (coffee/disc) on a blue background. Round motif.
daily,15538,gif,16,16,日常_IDM,ALL,https://images.heaton.com.cn/download/675bdcdf061f61.82476737,library_16/daily/15538.gif,white-appliance,A white robot/toaster appliance on a blue checkered background. Kitchen gadget.
daily,15539,gif,16,16,日常_IDM,ALL,https://images.heaton.com.cn/download/675bdcdf061fa6.24877110,library_16/daily/15539.gif,orange-juice,A glass of orange juice on a blue background. Cold drink.
daily,15540,gif,16,16,日常_IDM,ALL,https://images.heaton.com.cn/download/675bdcdf061fe7.16518555,library_16/daily/15540.gif,piggy-jar,A pink piggy bank/jar on a dark background. Savings motif.
daily,15541,gif,16,16,日常_IDM,ALL,https://images.heaton.com.cn/download/675bdcdf062014.08902641,library_16/daily/15541.gif,fire-phone,A phone/device with a fiery red screen on yellow. Hot-content motif.
daily,15542,gif,16,16,日常_IDM,ALL,https://images.heaton.com.cn/download/675bdcdf062050.98451044,library_16/daily/15542.gif,vase-flower,A pink flower in a vase on a white background. Floral arrangement.
daily,15543,gif,16,16,日常_IDM,ALL,https://images.heaton.com.cn/download/675bdcdf062093.66611115,library_16/daily/15543.gif,lollipop,A pink lollipop on a green background. Candy treat.
daily,15544,gif,16,16,日常_IDM,ALL,https://images.heaton.com.cn/download/675bdcdf0620d2.97353663,library_16/daily/15544.gif,popsicle,A chocolate popsicle/ice cream bar on a dark background. Frozen treat.
daily,15545,gif,16,16,日常_IDM,ALL,https://images.heaton.com.cn/download/675bdcdf062118.39019687,library_16/daily/15545.gif,gold-crown,A gold crown/star on a purple background. Royalty/award motif.
daily,15546,gif,16,16,日常_IDM,ALL,https://images.heaton.com.cn/download/675bdcdf062159.67356069,library_16/daily/15546.gif,tombstone,A purple tombstone/grave marker on a dark background. Spooky motif.
daily,15547,gif,16,16,日常_IDM,ALL,https://images.heaton.com.cn/download/675bdcdf062192.16944527,library_16/daily/15547.gif,food-plate-2,A plate of pancakes/dumplings on a dark background. Meal icon.
daily,15548,gif,16,16,日常_IDM,ALL,https://images.heaton.com.cn/download/675bdcdf0621c5.40469390,library_16/daily/15548.gif,egg-plate,A plate with eggs/snacks on a white background. Breakfast icon.
daily,15549,gif,16,16,日常_IDM,ALL,https://images.heaton.com.cn/download/675bdcdf062200.40343770,library_16/daily/15549.gif,cupcake,A pink cupcake/dessert on a purple background. Sweet treat.
daily,15550,gif,16,16,日常_IDM,ALL,https://images.heaton.com.cn/download/675bdcdf062240.89234267,library_16/daily/15550.gif,onigiri,A white rice ball (onigiri) with a little face on green. Cute Japanese snack.
daily,15551,gif,16,16,日常_IDM,ALL,https://images.heaton.com.cn/download/675bdcdf062283.45494544,library_16/daily/15551.gif,ghost-question,A white skull/ghost with a question mark on green. Spooky-confused motif.
daily,15552,gif,16,16,日常_IDM,ALL,https://images.heaton.com.cn/download/675bdcdf0622c3.38536155,library_16/daily/15552.gif,pink-figure,A pink figure/flamingo shape on a green background. Stylized character.
daily,15553,gif,16,16,日常_IDM,ALL,https://images.heaton.com.cn/download/675bdcdf062302.10004364,library_16/daily/15553.gif,bubble-tea,A cup of brown bubble/boba tea on a blue background. Trendy drink.
daily,15554,gif,16,16,日常_IDM,ALL,https://images.heaton.com.cn/download/675bdcdf062348.13541834,library_16/daily/15554.gif,french-fries,French fries in a red carton on a yellow background. Fast-food icon.
daily,15555,gif,16,16,日常_IDM,ALL,https://images.heaton.com.cn/download/675bdcdf062383.34024176,library_16/daily/15555.gif,rainbow,A rainbow arch on a black background. Colorful weather motif.
daily,15556,gif,16,16,日常_IDM,ALL,https://images.heaton.com.cn/download/675bdcdf0623c3.08001318,library_16/daily/15556.gif,pink-castle,A pink castle/crown structure on a tan background. Fairy-tale motif.
daily,15557,gif,16,16,日常_IDM,ALL,https://images.heaton.com.cn/download/675bdcdf062400.15942467,library_16/daily/15557.gif,coffee-cup,A brown cup of coffee on a dark blue background. Hot-drink icon.
daily,15558,gif,16,16,日常_IDM,ALL,https://images.heaton.com.cn/download/675bdcdf062440.99868128,library_16/daily/15558.gif,window-figure,A figure standing at a window on a dark background. Indoor vignette.
daily,15559,gif,16,16,日常_IDM,ALL,https://images.heaton.com.cn/download/675bdcdf062481.45623104,library_16/daily/15559.gif,candle,A white candle/figure on a dark background. Light motif.
daily,15560,gif,16,16,日常_IDM,ALL,https://images.heaton.com.cn/download/675bdcdf0624c3.35909301,library_16/daily/15560.gif,classroom,"A teacher at a green blackboard, a classroom scene. School motif."
daily,15561,gif,16,16,日常_IDM,ALL,https://images.heaton.com.cn/download/675bdcdf062508.38508328,library_16/daily/15561.gif,pink-door,A pink door/frame on a brown background. Doorway motif.
daily,15562,gif,16,16,日常_IDM,ALL,https://images.heaton.com.cn/download/675bdcdf062544.09457413,library_16/daily/15562.gif,colorful-scene,A scene of colorful shapes/blossoms on pink. Abstract garden vignette.
daily,15563,gif,16,16,日常_IDM,ALL,https://images.heaton.com.cn/download/675bdcdf062584.21725537,library_16/daily/15563.gif,cleaning-figure,A figure with a mop/staff on a blue background. Cleaning/chore scene.
daily,15564,gif,16,16,日常_IDM,ALL,https://images.heaton.com.cn/download/675bdcdf0625c0.24801961,library_16/daily/15564.gif,flying-bird,A white bird/dove flying in a blue sky. Nature scene.
daily,15565,gif,16,16,日常_IDM,ALL,https://images.heaton.com.cn/download/675bdcdf062619.94305553,library_16/daily/15565.gif,purple-cup,A purple cup of coffee on a dark background. Hot-drink icon.
daily,15566,gif,16,16,日常_IDM,ALL,https://images.heaton.com.cn/download/675bdcdf062657.21731272,library_16/daily/15566.gif,birdhouse,A wooden birdhouse/lantern on a dark background. Garden object.
daily,15567,gif,16,16,日常_IDM,ALL,https://images.heaton.com.cn/download/675bdcdf062693.19356822,library_16/daily/15567.gif,tan-face,A tan face/mask on a black background. Simple portrait.
daily,15568,gif,16,16,日常_IDM,ALL,https://images.heaton.com.cn/download/675bdcdf0626c9.65075835,library_16/daily/15568.gif,green-tv,A green TV/monitor on a green background. Screen motif.
daily,15569,gif,16,16,日常_IDM,ALL,https://images.heaton.com.cn/download/675bdcdf062704.92089377,library_16/daily/15569.gif,chef-penguin,A penguin/chef figure in black and white with red on dark. Cook character.
daily,15570,gif,16,16,日常_IDM,ALL,https://images.heaton.com.cn/download/675bdcdf062741.98118575,library_16/daily/15570.gif,latte,A cup of coffee with foam art on brown. Latte icon.
daily,15571,gif,16,16,日常_IDM,ALL,https://images.heaton.com.cn/download/675bdcdf062784.05964701,library_16/daily/15571.gif,fireplace,A gray fireplace/oven hearth on a dark background. Cozy interior.
daily,15572,gif,16,16,日常_IDM,ALL,https://images.heaton.com.cn/download/675bdcdf0627c1.00984712,library_16/daily/15572.gif,beer,A mug of beer with foam on a dark background. Drink icon.
daily,15573,gif,16,16,日常_IDM,ALL,https://images.heaton.com.cn/download/675bdcdf062809.80888554,library_16/daily/15573.gif,brown-bowl,A brown bowl of food with yellow contents on dark. Meal icon.
daily,15574,gif,16,16,日常_IDM,ALL,https://images.heaton.com.cn/download/675bdcdf062842.92423510,library_16/daily/15574.gif,soft-serve,A pink soft-serve ice cream swirl on green. Frozen treat.
daily,15575,gif,16,16,日常_IDM,ALL,https://images.heaton.com.cn/download/675bdcdf062885.30317797,library_16/daily/15575.gif,boombox,A gray boombox/cassette radio on a dark background. Retro audio device.
daily,15576,gif,16,16,日常_IDM,ALL,https://images.heaton.com.cn/download/675bdcdf0628b5.76756257,library_16/daily/15576.gif,donut-2,A glazed donut on a dark background. Sweet treat.
daily,15577,gif,16,16,日常_IDM,ALL,https://images.heaton.com.cn/download/675bdcdf062900.80476304,library_16/daily/15577.gif,green-mug,A green cup/mug with snow on a dark background. Winter drink.
daily,15578,gif,16,16,日常_IDM,ALL,https://images.heaton.com.cn/download/675bdcdf062945.41525891,library_16/daily/15578.gif,teapot,A blue teapot/kettle on a dark background. Hot-drink vessel.
daily,15579,gif,16,16,日常_IDM,ALL,https://images.heaton.com.cn/download/675bdcdf062980.40612012,library_16/daily/15579.gif,red-fruit,A red tomato/apple on a dark background. Fruit icon.
daily,15580,gif,16,16,日常_IDM,ALL,https://images.heaton.com.cn/download/675bdcdf0629c2.36316380,library_16/daily/15580.gif,burger-2,A loaded hamburger. Fast-food icon.
daily,15581,gif,16,16,日常_IDM,ALL,https://images.heaton.com.cn/download/675bdcdf062a04.53008594,library_16/daily/15581.gif,fireplace-2,A red fireplace/hearth on a blue background. Cozy interior.
daily,15582,gif,16,16,日常_IDM,ALL,https://images.heaton.com.cn/download/675bdcdf062a30.40296388,library_16/daily/15582.gif,garden,A garden/landscape with colorful flowers. Outdoor scene.
daily,15583,gif,16,16,日常_IDM,ALL,https://images.heaton.com.cn/download/675bdcdf062a73.41325226,library_16/daily/15583.gif,food-plate-3,A plate of food (egg/dumpling) on gray. Meal icon.
daily,15584,gif,16,16,日常_IDM,ALL,https://images.heaton.com.cn/download/675bdcdf062ac5.33280701,library_16/daily/15584.gif,green-fish,A green fish/creature on a dark background. Aquatic animal.
daily,15585,gif,16,16,日常_IDM,ALL,https://images.heaton.com.cn/download/675bdcdf062b01.43032409,library_16/daily/15585.gif,chef,A white-clad chef figure on a dark background. Cook character.
daily,15586,gif,16,16,日常_IDM,ALL,https://images.heaton.com.cn/download/675bdcdf062b43.25996144,library_16/daily/15586.gif,winter-clothes,A white scarf/gloves on a blue background. Winter clothing.
daily,15587,gif,16,16,日常_IDM,ALL,https://images.heaton.com.cn/download/675bdcdf062b84.11707588,library_16/daily/15587.gif,tree-field,A green field with a tree. Outdoor landscape.
daily,15588,gif,16,16,日常_IDM,ALL,https://images.heaton.com.cn/download/675bdcdf062bc3.50239985,library_16/daily/15588.gif,toaster,A gray toaster on a blue background. Kitchen appliance.
daily,15589,gif,16,16,日常_IDM,ALL,https://images.heaton.com.cn/download/675bdcdf062c01.31619760,library_16/daily/15589.gif,brown-owl,A brown owl/monkey face on a dark background. Animal portrait.
daily,15590,gif,16,16,日常_IDM,ALL,https://images.heaton.com.cn/download/675bdcdf062c31.20376227,library_16/daily/15590.gif,stone-figure,A gray stone statue/figure on a dark background. Sculpture motif.
daily,15591,gif,16,16,日常_IDM,ALL,https://images.heaton.com.cn/download/675bdcdf062c70.02426221,library_16/daily/15591.gif,sundae,A bowl of ice cream sundae with toppings on dark. Dessert.
daily,15592,gif,16,16,日常_IDM,ALL,https://images.heaton.com.cn/download/675bdcdf062cb0.81705386,library_16/daily/15592.gif,green-hair-figure,A green-haired figure/person on a blue background. Character portrait.
daily,15593,gif,16,16,日常_IDM,ALL,https://images.heaton.com.cn/download/675bdcdf062cf5.09218332,library_16/daily/15593.gif,sandwich,A green sandwich/sub on a dark background. Food icon.
daily,15594,gif,16,16,日常_IDM,ALL,https://images.heaton.com.cn/download/675bdcdf062d32.53478084,library_16/daily/15594.gif,parrot,A red-and-colorful parrot on a cyan background. Tropical bird.
daily,15595,gif,16,16,日常_IDM,ALL,https://images.heaton.com.cn/download/675bdcdf062d77.22271196,library_16/daily/15595.gif,blue-fish,A blue-and-purple fish on a light background. Aquatic animal.
daily,15596,gif,16,16,日常_IDM,ALL,https://images.heaton.com.cn/download/675bdcdf062db6.40057951,library_16/daily/15596.gif,pink-bird,A pink bird/chick on a pink background. Cute bird.
daily,15597,gif,16,16,日常_IDM,ALL,https://images.heaton.com.cn/download/675bdcdf062df9.44471342,library_16/daily/15597.gif,pink-heart,A pink 3D heart on a dark background. Love icon.
daily,15598,gif,16,16,日常_IDM,ALL,https://images.heaton.com.cn/download/675bdcdf062e31.36864789,library_16/daily/15598.gif,pancakes,A stack of pancakes with syrup on a yellow background. Breakfast treat.
daily,15599,gif,16,16,日常_IDM,ALL,https://images.heaton.com.cn/download/675bdcdf062e71.59578221,library_16/daily/15599.gif,well,A wooden well/lantern in a landscape. Outdoor structure.
daily,15600,gif,16,16,日常_IDM,ALL,https://images.heaton.com.cn/download/675bdcdf062eb7.34981184,library_16/daily/15600.gif,pink-vase,A pink flower/plant in a vase on a pink background. Floral arrangement.
daily,15601,gif,16,16,日常_IDM,ALL,https://images.heaton.com.cn/download/675bdcdf062ef5.59556594,library_16/daily/15601.gif,golf-flag,A golf flag on a green putting hole. Golf motif.
daily,15602,gif,16,16,日常_IDM,ALL,https://images.heaton.com.cn/download/675bdcdf062f29.38531849,library_16/daily/15602.gif,swimmer,A person swimming in blue water. Swimming/pool scene.
daily,15603,gif,16,16,日常_IDM,ALL,https://images.heaton.com.cn/download/675bdcdf062f62.25979451,library_16/daily/15603.gif,bunny,A white rabbit/bunny face on a blue background. Cute animal.
daily,15604,gif,16,16,日常_IDM,ALL,https://images.heaton.com.cn/download/675bdcdf062fa6.08907111,library_16/daily/15604.gif,moon,A gray moon/planet in a dark sky. Night scene.
daily,15605,gif,16,16,日常_IDM,ALL,https://images.heaton.com.cn/download/675bdcdf062fe1.84853785,library_16/daily/15605.gif,window,A window with curtains in an orange frame. Interior motif.
daily,15606,gif,16,16,日常_IDM,ALL,https://images.heaton.com.cn/download/675bdcdf063027.83411708,library_16/daily/15606.gif,husky,A black-and-white husky/dog face on green. Canine portrait.
daily,15607,gif,16,16,日常_IDM,ALL,https://images.heaton.com.cn/download/675bdcdf063064.15439816,library_16/daily/15607.gif,white-duck,A white duck/bird with a yellow beak on dark. Bird portrait.
daily,15608,gif,16,16,日常_IDM,ALL,https://images.heaton.com.cn/download/675bdcdf0630a9.72332118,library_16/daily/15608.gif,control-panel,A blue control panel/keyboard with buttons on dark. Tech device.
daily,15609,gif,16,16,日常_IDM,ALL,https://images.heaton.com.cn/download/675bdcdf0630e7.05157540,library_16/daily/15609.gif,bunny-carrot,A white rabbit with a carrot on a blue background. Easter/spring motif.
daily,15610,gif,16,16,日常_IDM,ALL,https://images.heaton.com.cn/download/675bdcdf063121.92322064,library_16/daily/15610.gif,green-monster,A green monster/frog with an open mouth on dark. Goofy creature.
daily,15611,gif,16,16,日常_IDM,ALL,https://images.heaton.com.cn/download/675bdcdf063169.02337530,library_16/daily/15611.gif,green-snake,A green snake/dragon on a gray background. Reptile creature.
daily,15612,gif,16,16,日常_IDM,ALL,https://images.heaton.com.cn/download/675bdcdf0631a6.68598873,library_16/daily/15612.gif,warrior,An armored warrior/knight figure on a purple background. Fighter character.
daily,15613,gif,16,16,日常_IDM,ALL,https://images.heaton.com.cn/download/675bdcdf0631e9.18516286,library_16/daily/15613.gif,sushi-bento,A sushi roll/bento box of food on a dark background. Japanese meal.
daily,15614,gif,16,16,日常_IDM,ALL,https://images.heaton.com.cn/download/675bdcdf063222.17159267,library_16/daily/15614.gif,pizza-oven,A pizza baking in a red oven on a dark background. Cooking scene.
daily,15615,gif,16,16,日常_IDM,ALL,https://images.heaton.com.cn/download/675bdcdf063269.71312880,library_16/daily/15615.gif,red-runner,A small red figure running on a black background. Action sprite.
daily,15616,gif,16,16,日常_IDM,ALL,https://images.heaton.com.cn/download/675bdcdf0632a1.95919920,library_16/daily/15616.gif,snow-globe,A snowy globe/planet on a teal background. Wintry sphere.
daily,15617,gif,16,16,日常_IDM,ALL,https://images.heaton.com.cn/download/675bdcdf0632f3.88860629,library_16/daily/15617.gif,night-skyline,A dark city skyline at night with lit windows. Urban scene.
daily,15618,gif,16,16,日常_IDM,ALL,https://images.heaton.com.cn/download/675bdcdf063329.30577798,library_16/daily/15618.gif,white-ghost,A white ghost on a dark background. Halloween spirit.
daily,15619,gif,16,16,日常_IDM,ALL,https://images.heaton.com.cn/download/675bdcdf063364.37129254,library_16/daily/15619.gif,green-hill,A green hill/mountain with a creature on cyan. Landscape scene.
daily,15620,gif,16,16,日常_IDM,ALL,https://images.heaton.com.cn/download/675bdcdf0633a1.14152046,library_16/daily/15620.gif,wreath-flower,A red flower/wreath with festive accents on green. Holiday decoration.
daily,15621,gif,16,16,日常_IDM,ALL,https://images.heaton.com.cn/download/675bdcdf0633f0.58625776,library_16/daily/15621.gif,scroll,A rolled scroll/letter on a striped surface. Paper/message motif.
daily,15622,gif,16,16,日常_IDM,ALL,https://images.heaton.com.cn/download/675bdcdf063435.22378500,library_16/daily/15622.gif,tan-animal,A tan cat/rabbit face on an orange background. Cute animal portrait.
daily,15623,gif,16,16,日常_IDM,ALL,https://images.heaton.com.cn/download/675bdcdf063474.58140195,library_16/daily/15623.gif,white-swan,A white bird/swan on a dark background. Bird portrait.
daily,15624,gif,16,16,日常_IDM,ALL,https://images.heaton.com.cn/download/675bdcdf0634b0.84806007,library_16/daily/15624.gif,dark-house,A dark house/building silhouette on a dark background. Spooky structure.
daily,15625,gif,16,16,日常_IDM,ALL,https://images.heaton.com.cn/download/675bdcdf0634e9.29917752,library_16/daily/15625.gif,red-apple,A red apple/cherry on a green background. Fruit icon.
daily,15626,gif,16,16,日常_IDM,ALL,https://images.heaton.com.cn/download/675bdcdf063523.31737089,library_16/daily/15626.gif,gray-cat,A gray cat face on a green background. Feline portrait.
